issue_no,repo,issue_url,title,description,patched_file_types
4919,nopCommerce,https://github.com/nopSolutions/nopCommerce/issues/4919,Display more user-friendly error when uploading non-picture file as a picture,"Steps to reproduce the problem: 1. Upload any non-picture file (e.g. XML or .cs) as a picture. For example, on a product details page 2. It gives a correct message that uploading failed. But also, 'Object reference not set to an instance of an object.' throwing error on picture controller side. Let's handle the exception so it's not thrown. There should be just an error text without an unhandled exception ![download](https://user-images.githubusercontent.com/5019111/86886520-c440dc80-c0ff-11ea-9869-c83c6e70e069.png) Source: https://www.nopcommerce.com/en/boards/topic/84221/picture-controller-in-get-error-object-reference-not-set-to-an-instance-of-an-object",source-file | ui-file
1811,nopCommerce,https://github.com/nopSolutions/nopCommerce/issues/1811,Vendors can see other vendor products in PDF,"When customer made order with products from at least two different vendors, each vendor may see just only own products, without any information about other products which do not belong to others. But if this same vendor will print invoice, will be able to see all products made by customer. Source: http://www.nopcommerce.com/boards/t/44621/vendor-pdf.aspx Furthermore, on some pages this button is hidden (details page) and on some it's not (list). And ""PdfInvoiceAll"" method has validation for vendors. But ""PdfInvoiceSelected"" has not",source-file | ui-file
5368,nopCommerce,https://github.com/nopSolutions/nopCommerce/issues/5368,Selected Other State on admin edit address click on save it will success but it is not updated in DB,"nopCommerce version: 4.40 beta Steps to reproduce the problem: 1. Admin > Edit Order 2. Click on Edit address 3. Select in State as ""other"", and click on save but it not reflected or updated https://prnt.sc/103n9t7",source-file
1738,nopCommerce,https://github.com/nopSolutions/nopCommerce/issues/1738,"Do not allow to specify 0 as ""Page Size"" (categories, vendors, manufacturers). Only positive values","Otherwise, exception will be thrown in public store - http://www.nopcommerce.com/boards/t/44098/bugexception-when-you-put-page-size-to-0-for-category.aspx let's just ensure that it'll work fine when ""Allow customers to select page size"" is enable (hence ""Page Size"" field is hidden but still set to 0)",database-file | source-file | data-file
7106,nopCommerce,https://github.com/nopSolutions/nopCommerce/issues/7106,CustomProperties have been marked as JsonIgnore,We use this property to extend the models by attaching data to them and passing the models to javascript. With the latest changes (see below) we are not able to do that anymore. Is there an alternative solution for us now if you have made this on purpose? How could we pass additional data to the exisiting models and use it in js? https://github.com/nopSolutions/nopCommerce/blob/8c45936960958d75eac5097bcf69fe88c8d10274/src/Presentation/Nop.Web.Framework/Models/BaseNopModel.cs#L42,source-file
1731,nopCommerce,https://github.com/nopSolutions/nopCommerce/issues/1731,Search starts with < shows error,When we search any term starting with < sign (i.e: <abc) in search box it goest to errorpage and show internal issue. kindly check this Source: http://www.nopcommerce.com/boards/t/44053/search-starts-with-shows-error.aspx,source-file
6007,nopCommerce,https://github.com/nopSolutions/nopCommerce/issues/6007,"Do not allow to delete the only one template (category, manufacturer, product, topic)",nopCommerce version: 4.5 beta Steps to reproduce the problem: step 1 : Go Admin/Template/List step 2: delete manufacture and category template step 3 : open detail page of both template at front end you will get internal server error. **Note** : validation is there at least one template is there. https://www.loom.com/share/5c691d9e162f4feba4a902e57442ebd3,source-file | data-file
1602,nopCommerce,https://github.com/nopSolutions/nopCommerce/issues/1602,Category/manufacturer import/export doesn't work as expected,"SeName is not exported. Hence it's not imported for new categories. New categories and manufacturers don't have ""search engine friendly name""",source-file
6458,nopCommerce,https://github.com/nopSolutions/nopCommerce/issues/6458,News details page Redirect page not found after reload,"nopCommerce version: 4.60- Beta Steps to reproduce the problem: - Open news details page, (*) sing are missing for validation - Submit new Comment without putting title and comment - Now page url will change /nopcommerce-new-release to /News/NewsCommentAdd?newsitemid=2 - Please Refresh Page from URL - You will redirect into **Page not found** page",ui-file
4611,nopCommerce,https://github.com/nopSolutions/nopCommerce/issues/4611,Case sensitive ErrorPage.htm on Linux,nopCommerce version: 4.20 Steps to reproduce the problem: Any server error on Linux. The file is named ErrorPage.htm in wwwroot but the Error action in ErrorController returns lower case errorpage.htm resulting in a 404 error.,source-file
4548,nopCommerce,https://github.com/nopSolutions/nopCommerce/issues/4548,Activity Types data table - Invalid JSON response when refresh grid,"nopCommerce version: 4.30 beta Steps to reproduce the problem: 1) Go /Admin/ActivityLog/ActivityTypes 2) scroll down and refresh table You will get this error **DataTables warning: table id=activityLogType-grid - Invalid JSON response. For more information about this error, please see http://datatables.net/tn/1**",ui-file
3468,nopCommerce,https://github.com/nopSolutions/nopCommerce/issues/3468,Shopping carts and wishlists page (admin). Product name is not displayed,"Right now it displays ""null"" instead of actual product names",source-file
3260,nopCommerce,https://github.com/nopSolutions/nopCommerce/issues/3260,Price not updated when multiples rental products are linked to the same grouped product,"nopCommerce version: 4.1 (not tested on previous version) Steps to reproduce the problem: - Create a **grouped** product. Let's call it ""Book"" - Create a simple product of type **rental**. Let's call it ""Book Daily"" and link it to the grouped product named Book - Create a simple product of type **rental**. Let's call it ""Book Monthly"" and link it to the grouped product named Book - On front end side, open the product page ""Book"", below are displayed all the products linked to this grouped product family ""Book"":. - When we update the starting and ending rental date of ""Book Daily"", the price is not updated at all First investigation: - Analysing the issue with Chrome console, it seems that the bug is linked to multiple definition of JS functions that should update the price. (they use the same name). Because of that, the wrong method is called and therefore wrong parameters are sent to the backend. After that on backend side, a null pointer exception happended and the price cannot be calculated again. Thanks",ui-file
2777,nopCommerce,https://github.com/nopSolutions/nopCommerce/issues/2777,/customer/productreviews shows reviews on deleted products,"How to reproduce - 1. Create a product 2. Leave a review on said product 3. Delete said product 4. Go to /customer/productreviews 5. Note, the review is visible",data-file | config-file | source-file | other-file | documentation-file
3376,nopCommerce,https://github.com/nopSolutions/nopCommerce/issues/3376,Advance search is not working,"nopCommerce version: 4.10 Steps to reproduce the problem: 1. Go to nopCommerce demo store 2. Type ""Apple"" in search box and click on search button (page URL - http://demo.nopcommerce.com/search?q=apple ) 3. Now check Advanced search checkbox and click on search button (page URL - http://demo.nopcommerce.com/search?q=apple&adv=true&cid=0&mid=0&pf=&pt=&adv=false&isc=false&sid=false ) 4. Now select any option from Catalog selector (Sort option/Page Size/Display Mode) - **it will throw an error** (Selected sort by Name - A to Z - http://demo.nopcommerce.com/search?q=apple&adv=true,false&cid=0&mid=0&pf=&pt=&isc=false&sid=false&orderby=5) Error Message:  An unhandled exception occurred while processing the request. FormatException: String was not recognized as a valid Boolean. bool.Parse(ReadOnlySpan<char> value) FormatException: true,false is not a valid value for Boolean. Nop.Web.Framework.Infrastructure.Extensions.ApplicationBuilderExtensions+<>c.<UseNopExceptionHandler>b__1_1(HttpContext context) in ApplicationBuilderExtensions.cs, line 85  Here in last url parameter adv = adv=true,false if you selected option **Search In product descriptions ** as true then parameter : sid=true,false I looked in source and found input tag (i.e. <input asp-for=""sid"" />)generate two times input. Here is source image: ![advance-search](https://user-images.githubusercontent.com/13154058/46921627-4f6c6b80-d01b-11e8-88aa-7a4a63d140c0.png)",source-file
6484,nopCommerce,https://github.com/nopSolutions/nopCommerce/issues/6484,Estimate Shipping Errors not showing,"nopCommerce version: 4.50.3 Steps to reproduce the problem: Errors provided by the Property Error in GetShippingOptionResponse is not being shown in frontend. In Nop.Services.Shipping.GetShippingOptionsResponse: csharp  <summary>  Gets a value indicating whether request has been completed successfully  </summary> public bool Success => !Errors.Any();  It says that Success is only True when there are no Errors. But: On Nop.Web.Factories.ShoppingCartModelFactory: csharp var getShippingOptionResponse = await _shippingService.GetShippingOptionsAsync(cart, address, customer, storeId: store.Id); if (getShippingOptionResponse.Success) { if (getShippingOptionResponse.ShippingOptions.Any()) { foreach (var shippingOption in getShippingOptionResponse.ShippingOptions) { rawShippingOptions.Add(new ShippingOption { Name = shippingOption.Name, Description = shippingOption.Description, Rate = shippingOption.Rate, TransitDays = shippingOption.TransitDays, ShippingRateComputationMethodSystemName = shippingOption.ShippingRateComputationMethodSystemName }); } } else { foreach (var error in getShippingOptionResponse.Errors) model.Errors.Add(error); } }  So The errors will only add when if (getShippingOptionResponse.Success) is True But Success indicate no errors. When Success is False, the code that add the errors will not execute. This is causing estimate Shipping Errors not showing on estimateshipping popup. Thx",source-file
5907,nopCommerce,https://github.com/nopSolutions/nopCommerce/issues/5907,Estimate shipping not applying on the shopping cart page,"> I have found a bug in the Cart page where after selecting a shipping method it's not updating in the order summary section > > 1. nopCommerce version: 4.40.4 > > 2. Expected behavior: After selecting a shipping method order summary should show the selected > shipping method and prices should adjust accordingly if applicable > > 3. Actual behavior: Order Summary not updating after selecting shipping method > > 4. Steps to reproduce the problem: Go to cart page after you have added products , then click on estimate shipping and select a shipping method > > 5. Any private modifications : No > > Reasons for the problem : > An Invalid url parameter is being sent as a ""$"" sign is placed in the requested url . > > > Solution : > Remove `$` sign from the the following cshtml => [src/Presentation/Nop.Web/Views/Shared/Components/ShoppingCartEstimateShipping/Default.cshtml](https://github.com/nopSolutions/nopCommerce/blob/develop/src/Presentation/Nop.Web/Views/Shared/Components/ShoppingCartEstimateShipping/Default.cshtml#L57) > where a ajax request is being sent to the following route ""shoppingcart/selectshippingoption"" Source: https://www.nopcommerce.com/boards/topic/92236/cart-page-estimate-shipping-not-applying-bug",test-file
5384,nopCommerce,https://github.com/nopSolutions/nopCommerce/issues/5384,Can't properly decode an URL if it contains slugs names that are also parameter names.,"nopCommerce 4.3 Please read: [Link to NopCommerce](https://www.nopcommerce.com/en/boards/topic/90303/receiving-404-error-on-the-root-category-after-upgrade-to-43) Using a debugger, I set a breakpoint on Line 96 of Category  public virtual IActionResult Category(int categoryId, CatalogPagingFilteringModel command) { var category = _categoryService.GetCategoryById(categoryId); if (category == null || category.Deleted) return InvokeHttp404();   At first, I thought there was something wrong with my debugger setup because I couldn't hit the breakpoint www.store.com/products. When I clicked on another category, however, it worked. The 404 error wasn't generated in the Category method. I changed the slug name to ""products-test"" under **Catalog > Categories > ""Products"" > Search engine friendly page name ** and it magically again hit my breakpoint. Very strange! I also tried to clear the Slug name, but it automatically generated ""products"" after the category name and still didn't hit the break point. Finally, I deleted the Slug in **System > Search engine friendly page names** and the Slug field became blank. Navigating, however, to the page didn't result in a 404 error, but gave me a blank page. I checked my configuration to see if I had any URL redirections at the web server level, but I didn't have any. I also cleared the cache to rid any stale values from the system. I finally found the cause of the error. The fact ""products"" gave me a 404, but not other slug names lead me to suspect it may be a parsing issue. I tried ""category""and ""product"" as a slug names and it also gave me 404 errors! The URL routing in NopCommerce 4.3 cannot handle cases where the Slug is the same as a parameter name! It appears the URL decoding has changed since 4.2. The best fix would be to either correct the URL decoding or add validation logic on all user entered slug names.",source-file
6686,nopCommerce,https://github.com/nopSolutions/nopCommerce/issues/6686,Wrong product URL in email message,"nopCommerce version: 4.60 Steps to reproduce the problem: We have created new message template for products and in MessageTokenProvide.cs at method AddProductTokensAsync the line  await RouteUrlAsync(routeName: ""Product"", routeValues: new { SeName = await _urlRecordService.GetSeNameAsync(product) });  returns always empty string. We changed the route name to ""ProductDetails"" and the URL is now correct. But I think, here should be used something similar like in the RouteProductUrlAsync (NopUrlHelper.cs) where is much complex logic for creating product url.",source-file
3382,nopCommerce,https://github.com/nopSolutions/nopCommerce/issues/3382,Redis cache clear error in nopCommerce 4.10,"nopCommerce version: 4.10 Steps to reproduce the problem: 1. Enable Redis cache. 2. Open admin page. 3. Click ""Clear cache"" Application returns code 500 error.",source-file
6033,nopCommerce,https://github.com/nopSolutions/nopCommerce/issues/6033,Reset password does not work when an email contains a +,"nopCommerce version: Latest Steps to reproduce the problem: - Create an account with an email like ""test+test@gmail.com"" - Send the password reset link - The URL in the email will contain ""email=test+test@gmail.com"" which model binds in MVC to email=""test test@gmail.com"". - Clicking the reset link sends you to the homepage and does not allow you to reset your password The URL parameters should be escaped as ""email=test%2Btest@gmail.com"". In a URL, the + acts as a space. It appears this is caused in MessageTokenProvider.cs. ![image](https://user-images.githubusercontent.com/214307/146073863-d955273f-67b0-4019-b362-0557a4609845.png) `urlHelper.RouteUrl(routeName, routeValues))` results in a properly escaped URL. But when you pass this into the PathString constructor, it escapes everything. You then UrlDecode it later resulting in an unecoded + in the email value. Microsoft's documentation specifically says not to use PathString with an encoded URL. I don't have time to issue a pull request now but we fixed it by doing this: ![image](https://user-images.githubusercontent.com/214307/146074406-95ef1780-b03d-48df-9644-91511893969e.png)",source-file
4943,nopCommerce,https://github.com/nopSolutions/nopCommerce/issues/4943,Estimate Shipping - shipping provider warnings not displayed,"1. nopCommerce version 4.30 2. Expected behavior - error/warning messages from shipping providers should be displayed 3. Actual behavior - if a shipping provider plugin returns any errors, they are ignored 4. Steps to reproduce the problem - Select ""Estimate Shipping"" button on the cart page. The dialog pops up. - Enter address information - If the shipping provider plugin reports any errors (like UPS indicating invalid address, or Shipping Director's Error/ErrorExit rule returning a warning message like ""call for shipping""), they are not displayed. (Note that if you blank out the zip/postal code field, you do see an error message for ""Zip / postal code is required"", so the dialog does support the display of messages) The code does not look right. Only when 'Success' is true does it enter the block where Warnings are set: \Presentation\Nop.Web\Factories\ShoppingCartModelFactory.cs csharp public virtual EstimateShippingResultModel PrepareEstimateShippingResultModel()  var getShippingOptionResponse = _shippingService.GetShippingOptions(); if (getShippingOptionResponse.Success) { if (getShippingOptionResponse.ShippingOptions.Any()) { foreach (var shippingOption in getShippingOptionResponse.ShippingOptions) {} } else foreach (var error in getShippingOptionResponse.Errors) model.Warnings.Add(error); }  see also: https://www.nopcommerce.com/en/boards/topic/84921/estimate-shipping-on-cart-page-for-430-shipping-provider-warnings-not-displayed",source-file
