issue_no,repo,issue_url,title,description,patched_file_types
7191,awx,https://github.com/ansible/awx/issues/7191,Invalid HTTP request when Conjur credential secret has a space in the name,ISSUE TYPE - Bug Report  SUMMARY Invalid HTTP request when Conjur credential secret has a space in the name  STEPS TO REPRODUCE Create a conjur credential containing a space. When retrieving the credential a 404 is returned from conjur. The reason for this is because the conjur credential plugin url encodes the secretID with a `+` however conjur is expecting a `%20`.  EXPECTED RESULTS To get back the credential content.  ACTUAL RESULTS AWX fails to retrieve the credential and a 404 is returned.  ADDITIONAL INFORMATION,documentation-file | source-file
11350,awx,https://github.com/ansible/awx/issues/11350,Instance group basic Name search missing __icontains,"Please confirm the following - [X] I agree to follow this project's [code of conduct](http://docs.ansible.com/ansible/latest/community/code_of_conduct.html). - [X] I have checked the [current issues](https://github.com/ansible/awx/issues) for duplicates. - [X] I understand that AWX is open source software provided for free and that I am not entitled to status updates or other assurances.  Summary When searching a list of instance groups the __icontains parameter is missing. This means that a user can do a basic search for a string contained within the name of an existing instance group, and the UI will return no results. ![image](https://user-images.githubusercontent.com/63685497/142051117-77ea7fad-6d6e-4d35-a830-66435ac89c29.png)  AWX version 4.1  Installation method docker on linux  Modifications no  Ansible version _No response_  Operating system _No response_  Web browser _No response_  Steps to reproduce To reproduce: 1. Create an instance group 2. Visit the list of instance groups and do a basic Name search for part of the name you gave the instance group. No results.  Expected results If an instance group exists, searching for part of the name should bring up a result.  Actual results The UI shows no results  Additional information _No response_",source-file
11130,awx,https://github.com/ansible/awx/issues/11130,Disable editing more fields of `controlplane` group,"Please confirm the following - [X] I agree to follow this project's [code of conduct](http://docs.ansible.com/ansible/latest/community/code_of_conduct.html). - [X] I have checked the [current issues](https://github.com/ansible/awx/issues) for duplicates. - [X] I understand that AWX is open source software provided for free and that I am not entitled to status updates or other assurances.  Summary Users are able to modify several fields of the `controlplane` instance group, which they probably shouldn't be allowed to edit (these edits will break things).  AWX version 19.2.2  Installation method docker on linux  Modifications no  Ansible version devel  Operating system N/A  Web browser Chrome  Steps to reproduce PATCH to `/api/v2/instance_groups/N/` where that record has the `name` of ""controlplane"" try giving all the fields (individually) a non-default value: json ""name"": ""controlplane"", ""is_container_group"": false, ""credential"": null, ""policy_instance_percentage"": 98, ""policy_instance_minimum"": 0, ""policy_instance_list"": [], ""pod_spec_override"": """"   Expected results Most of these should give a 400 error  Actual results Only modifying `name` gives a 400 Out of the others, particularly problematic seeming ones are: - I can set `is_container_group` to true that doesn't sound good - I can set `policy_instance_percentage` to a value lower than what was set by the installer, which is probably not desired (maybe arguable? but I doubt it) - I can add execution nodes to `policy_instance_list`, which is absolutely not okay  Additional information _No response_",test-file | source-file
10118,awx,https://github.com/ansible/awx/issues/10118,Jobs on systems missing EEs throw an error instead of failing,"ISSUE TYPE - Bug Report  SUMMARY If the user fails to have an execution environment available, the dispatcher will raise an error and a traceback will go to the logs, but the feedback provided to the user via the UI or API is mysterious.  ENVIRONMENT * AWX version: 19.1.0  STEPS TO REPRODUCE 1. deliberately delete all EEs, including any installed managed-by-tower EEs 2. trigger a project update  EXPECTED RESULTS If there are no EEs available, the job should fail with an explicit reason provided in the job output in the UI.  ACTUAL RESULTS job output: ![image(4)](https://user-images.githubusercontent.com/685957/117202438-d17c3580-adbb-11eb-8d5e-ab255aefeacc.png) in the logs:  tools_awx_1 | awx-dispatcher stdout | 2021-05-05 19:46:16,092 ERROR [c77b9784] awx.main.tasks project_update 17 (running) Exception occurred while running task tools_awx_1 | awx-dispatcher stdout | Traceback (most recent call last): tools_awx_1 | awx-dispatcher stdout | File ""/awx_devel/awx/main/tasks.py"", line 1316, in run tools_awx_1 | awx-dispatcher stdout | env = self.build_env(self.instance, private_data_dir, private_data_files=private_data_files) tools_awx_1 | awx-dispatcher stdout | File ""/awx_devel/awx/main/tasks.py"", line 1883, in build_env tools_awx_1 | awx-dispatcher stdout | env = super(RunProjectUpdate, self).build_env(project_update, private_data_dir, private_data_files=private_data_files) tools_awx_1 | awx-dispatcher stdout | File ""/awx_devel/awx/main/tasks.py"", line 997, in build_env tools_awx_1 | awx-dispatcher stdout | ee_cred = self.instance.execution_environment.credential tools_awx_1 | awx-dispatcher stdout | AttributeError: 'NoneType' object has no attribute 'credential' tools_awx_1 | awx-dispatcher stdout |",test-file | source-file
9669,awx,https://github.com/ansible/awx/issues/9669,Cannot save Miscellaneous System Settings on new cluster,"<!-- Issues are for **concrete, actionable bugs and feature requests** only - if you're just asking for debugging help or technical support, please use: - http://webchat.freenode.net/?channels=ansible-awx - https://groups.google.com/forum/#!forum/awx-project We have to limit this because of limited volunteer time to respond to issues! -->  ISSUE TYPE - Bug Report  SUMMARY I cannot save my changes to the Miscellaneous System settings of a newly created AWX Tower install. I receive no UI feedback but the network tab shows `{""CUSTOM_VENV_PATHS"":[""Expected list of strings but got <class 'str'> instead.""]}`. I have not attempted to set up custom venvs, nor can I find that setting in the UI.  ENVIRONMENT * AWX version: 18.0.0 * AWX install method: minikube following https://github.com/ansible/awx/blob/devel/INSTALL.md * Ansible version: unknown * Operating System: ArchLinux * Web Browser: Firefox 87  STEPS TO REPRODUCE 1. Install a new instance of AWX using the instructions given in the INSTALL.md file 2. Log in as admin 3. Edit settings under /#/settings/miscellaneous_system/details 4. Attempt to change the base url from ""https://towerhost"" to my actual base URL. 5. Hit save  EXPECTED RESULTS Settings save and UI reverts to the details page.  ACTUAL RESULTS No UI feedback at all, following error in network tab.  {""CUSTOM_VENV_PATHS"":[""Expected list of strings but got <class 'str'> instead.""]}  The PATCH request is sent to https://MYDOMAIN/api/v2/settings/all/ and has the following relevant data:  ""CUSTOM_VENV_PATHS"":""[]""   ADDITIONAL INFORMATION <!-- Include any links to sosreport, database dumps, screenshots or other information. -->",test-file | documentation-file | source-file
7063,awx,https://github.com/ansible/awx/issues/7063,POSTing to create workflow approval node (node without UJT) ignores all_parents_must_converge,"ISSUE TYPE - Bug Report  SUMMARY ![all_parents](https://user-images.githubusercontent.com/9889020/82239367-abd5f200-9906-11ea-8c60-39ef86625ff8.gif) Relates to https://github.com/ansible/awx/issues/6998  STEPS TO REPRODUCE 1. Create an empty workflow 2. Attempt to POST to `/api/v2/workflow_job_templates/:id/workflow_nodes/` with the following payload:  { ""all_parents_must_converge"": true }   EXPECTED RESULTS A node is created with `all_parents_must_converge` set to `true`  ACTUAL RESULTS A node is created with `all_parents_must_converge` set to `false`  ADDITIONAL INFORMATION The use case here is approval nodes. In order to create an approval node in the UI we make this initial POST request to create the node. After we have a node, we create the corresponding approval template. If the user were to attempt to create a new approval node in the UI where `all_parents_must_converge` was set to true it would currently save but `all_parents_must_converge` would be set to false. If this becomes problematic to fix, the UI could always issue a 3rd request to go back and PATCH the node from the first request but this would be less desirable.",source-file | config-file | data-file | test-file | other-file | documentation-file
9472,awx,https://github.com/ansible/awx/issues/9472,awx.main.utils.common.get_ansible_version breaks with ansible-core,"<!-- Issues are for **concrete, actionable bugs and feature requests** only - if you're just asking for debugging help or technical support, please use: - http://webchat.freenode.net/?channels=ansible-awx - https://groups.google.com/forum/#!forum/awx-project We have to limit this because of limited volunteer time to respond to issues! -->  ISSUE TYPE - Bug Report  SUMMARY <!-- Briefly describe the problem. --> The `awx.main.utils.common.get_ansible_version` helper breaks with new `ansible --version` when ansible-core is installed. This also changes the format the `api/v2/config` returns for the `ansible_version` field. What breaks tools that relies on this field to check the current ansible version used by AWX.  ENVIRONMENT * AWX version: devel * AWX install method: vm * Ansible version: ansible-core 2.11 * Operating System: RHEL8.3 * Web Browser:  STEPS TO REPRODUCE <!-- Please describe exactly how to reproduce the problem. --> Install AWX with ansible-core and perform a GET request to `/api/v2/config` and check the `ansible_version` field format.  EXPECTED RESULTS <!-- What did you expect to happen when running the steps above? --> The ansible version format should be something like `X.Y.Z` (format capable to be parsed by tools like `distutils.version.LooseVersion`)  ACTUAL RESULTS <!-- What actually happened? --> Returning something like `""ansible_version"": ""[core 2.11.0.dev0]""`  ADDITIONAL INFORMATION <!-- Include any links to sosreport, database dumps, screenshots or other information. --> Output of `ansible --version` for ansible-core 2.11: console $ ansible --version ansible [core 2.11.0b1] config file = /home/elyezer/code/ansible/ansible-core/ansible.cfg configured module search path = ['/home/elyezer/.ansible/plugins/modules', '/usr/share/ansible/plugins/modules'] ansible python module location = /home/elyezer/.virtualenvs/ansible-core/lib/python3.9/site-packages/ansible ansible collection location = /home/elyezer/.ansible/collections:/usr/share/ansible/collections executable location = /home/elyezer/.virtualenvs/ansible-core/bin/ansible python version = 3.9.0 (default, Oct 6 2020, 00:00:00) [GCC 10.2.1 20200826 (Red Hat 10.2.1-3)] jinja version = 2.11.3 libyaml = True  For ansible 2.9:  ansible 2.9.16 config file = /home/elyezer/code/ansible/ansible/ansible.cfg configured module search path = ['/home/elyezer/.ansible/plugins/modules', '/usr/share/ansible/plugins/modules'] ansible python module location = /home/elyezer/.virtualenvs/ansible/lib/python3.9/site-packages/ansible executable location = /home/elyezer/.virtualenvs/ansible/bin/ansible python version = 3.9.0 (default, Oct 6 2020, 00:00:00) [GCC 10.2.1 20200826 (Red Hat 10.2.1-3)]",test-file | source-file
4542,awx,https://github.com/ansible/awx/issues/4542,Google Cloud Compute Engine credential type is stripping the json file,"ISSUE TYPE - Bug Report  SUMMARY When a google compute engine credential is created with the json credential file, AWX is stripping some valuable lines. I need those, as I am using gcp_compute_disk module which also requires the service account file to be give as absolute path to the json and instead of giving the file path twice manually, I am using {{ lookup('env','GCP_SERVICE_ACCOUNT_FILE') }} to refer the absolute path to the json, but I am getting error that the lines about email and token_uri are missing. In order to resolve that I was forced to create a custom credential type for uploading the json and use it without stripping.  ENVIRONMENT * AWX version: 6.x.x * AWX install method: docker * Ansible version: 2.8.2 * Operating System: Ubuntu 18.04 * Web Browser: Firefox, Chrome  STEPS TO REPRODUCE Upload a google json credential to awx and try to use the service_account_file: ""{{ lookup('env','GCP_SERVICE_ACCOUNT_FILE') }}"" when using the gcp_compute_disk module for example. Your AWX template must be pointed to the gce credential also.  EXPECTED RESULTS get the full json and take all needed lines  ACTUAL RESULTS gets the json, but it seems the AWX module for gce credenials strips some lines and the file is usable by the gcp_compute_* ansible modules.  ADDITIONAL INFORMATION New credential type I've used to get around this is: Input configuration: `fields: - id: gcp_credential_file type: string label: GCP Credential File (JSON) secret: true multiline: true` Injector configuration: `env: GCP_SERVICE_ACCOUNT_FILE: '{{ tower.filename }}' file: template: '{{ gcp_credential_file }}'`",test-file | source-file
13120,awx,https://github.com/ansible/awx/issues/13120,Add Conjur Cloud support to CyberArk Conjur Secrets Lookup credential plugin,"Please confirm the following - [X] I agree to follow this project's [code of conduct](https://docs.ansible.com/ansible/latest/community/code_of_conduct.html). - [X] I have checked the [current issues](https://github.com/ansible/awx/issues) for duplicates. - [X] I understand that AWX is open source software provided for free and that I might not receive a timely response.  Bug Summary Conjur Cloud adds the requirement of `/api` after the base domain of the service prior to endpoints that are currently configured in the credential plugin. Providing `/api` as part of the URL on the secret lookup gets trimmed by `urllib.parse.urljoin()` that builds the URL to send API requests when executing the credential plugin.  AWX version 21.7.0  Select the relevant components - [ ] UI - [X] API - [ ] Docs - [ ] Collection - [ ] CLI - [ ] Other  Installation method docker development environment  Modifications no  Ansible version 2.13.5  Operating system Ubuntu 22.04.1 LTS  Web browser _No response_  Steps to reproduce With a Conjur Cloud tenant available to target, configure the CyberArk Conjur Secrets Lookup external management system credential plugin as documented.  Expected results Tests should pass successfully.  Actual results Tests to retrieve a secret will return `HTTP 404`.  Additional information A PR is prepared and will be submitted shortly.",test-file | documentation-file | source-file
5983,awx,https://github.com/ansible/awx/issues/5983,List Navigation 404,ISSUE TYPE - Bug Report  SUMMARY List navigation error.  ENVIRONMENT * AWX version: 2.10 * AWX install method: docker for mac * Ansible version: 9.2.1 * Operating System: Mojave * Web Browser: Chrome  STEPS TO REPRODUCE Go to a list and select either 5 or 10 items per page. Navigate to the last page. Then select a number of items per page higher that what you selected originally. If you selected 5 items per page originally then select 10 items per page.  EXPECTED RESULTS Page should reset to the first page and no 404 error  ACTUAL RESULTS 404 error  ADDITIONAL INFORMATION ![navigation bug](https://user-images.githubusercontent.com/39280967/74779455-84ba4680-526b-11ea-9fad-8fb59a1bd556.gif),test-file | data-file
6460,awx,https://github.com/ansible/awx/issues/6460,Unable to save any forms,"ISSUE TYPE - Bug Report  SUMMARY <!-- Briefly describe the problem. --> I'm unable to save any forms in AWX 9.3.0. When I try to click on the save button to create a new sample project or add LDAP authencatication I have a status code 504. And the form is never saved.  ENVIRONMENT * AWX version: 9.3.0 * AWX install method: docker on linux * Ansible version: 2.9.5 * Operating System: CentOS 7.7 * Web Browser: Chrome and Chrome in private  STEPS TO REPRODUCE <!-- Please describe exactly how to reproduce the problem. --> Create a new project sample and click save  EXPECTED RESULTS <!-- What did you expect to happen when running the steps above? --> The form should be saved  ACTUAL RESULTS <!-- What actually happened? --> Failed to create new project. POST returned status: 504  ADDITIONAL INFORMATION <!-- Include any links to sosreport, database dumps, screenshots or other information. --> In the logs I can see : `awx_web | 2020/03/27 14:23:31 [error] 122#0: *47 upstream timed out (110: Connection timed out) while reading response header from upstream, client: 10.204.35.76, server: _, request: ""GET /websocket/ HTTP/1.1"", upstream: ""http://127.0.0.1:8051/websocket/"", host: ""myserver:82"" ` And in the browser console I have :  Failed to load resource: the server responded with a status of 504 (Gateway Time-out) WebSocket connection to 'ws://myserver:82/websocket/' failed: WebSocket opening handshake timed out",source-file
6309,awx,https://github.com/ansible/awx/issues/6309,POST to api/v2/inventories/<ID>/inventory_sources/ with id and name gets 201 created (should be 400),"ISSUE TYPE - Bug Report  SUMMARY <!-- Briefly describe the problem. --> I was trying to associate an inventory script with an inventory as an inventory source. When I did a POST to api/v2/inventories/<ID>/inventory_sources/ with id and name I got a 201 created (should be 400) and an inventory source object back. I then launched an inventory update and the following traceback was produced:  Traceback (most recent call last): File ""/var/lib/awx/venv/awx/lib64/python3.6/site-packages/awx/main/tasks.py"", line 1308, in run args = self.build_args(self.instance, private_data_dir, passwords) File ""/var/lib/awx/venv/awx/lib64/python3.6/site-packages/awx/main/tasks.py"", line 2472, in build_args if getattr(settings, '%s_EXCLUDE_EMPTY_GROUPS' % src.upper()): File ""/var/lib/awx/venv/awx/lib64/python3.6/site-packages/awx/conf/settings.py"", line 511, in __getattr_without_cache__ return getattr(self._wrapped, name) File ""/var/lib/awx/venv/awx/lib64/python3.6/site-packages/awx/conf/settings.py"", line 418, in __getattr__ value = self._get_default(name) File ""/var/lib/awx/venv/awx/lib64/python3.6/site-packages/awx/conf/settings.py"", line 405, in _get_default return getattr(self.default_settings, name) AttributeError: 'Settings' object has no attribute '_EXCLUDE_EMPTY_GROUPS'  Seems like the bug is that we are not requiring the `source` perhaps among other things and ignoring `id`",source-file
7665,awx,https://github.com/ansible/awx/issues/7665,API should not accept modification of local_path for nom-manual projects,"ISSUE TYPE - Bug Report  SUMMARY The API will accept a PATCH to edit `local_path` for a git project, but the change will not take effect. Some version of a 400 error would be preferable to this. This is a valid field to edit in the case of manual projects, so there's no valid justification that it's ""not a field"".  ENVIRONMENT * AWX version: 13.0.0 * AWX install method: N/A * Ansible version: N/A  STEPS TO REPRODUCE PATCH `/api/v2/projects/6/` json { ""description"": ""asdf"", ""local_path"": ""_6__demo_project_edited"" }   EXPECTED RESULTS One of: - the local_path value changes to ""_6__demo_project_edited"" - get error  ACTUAL RESULTS No error description changes to ""asdf"" the `local_path` remains at prior value of ""_6__demo_project""",test-file | source-file
5528,awx,https://github.com/ansible/awx/issues/5528,New AWX CLI returns type error when modifying list or dict settings,"ISSUE TYPE - Bug Report  SUMMARY When trying to modify a list or dictionary valued setting from the **awx** command line tool, the API return a type error.  ENVIRONMENT * AWX version: 9.0.1 * AWX install method: Kubernetes * Ansible version: 2.7.11 * Operating System: Ubuntu 18.04 * Web Browser: Firefox 71  STEPS TO REPRODUCE 1. Install the AWX CLI tool:  pip install ""https://github.com/ansible/awx/archive/9.0.1.tar.gz#egg=awxkit&subdirectory=awxkit""  2. Try to modify the AUTH_LDAP_GROUP_SEARCH (type list) setting  awx settings modify AUTH_LDAP_USER_SEARCH '[""DC=example,DC=com"",""SCOPE_SUBTREE"",""(uid=%(user)s)""]'  3. Receive the following error  {""AUTH_LDAP_USER_SEARCH"": [""Expected a list of items but got type \""str\"".""]}   EXPECTED RESULTS Expected to modify the setting like the old tower-cli or awx-cli tools were able to.  ACTUAL RESULTS Received a type error  {""AUTH_LDAP_USER_SEARCH"": [""Expected a list of items but got type \""str\"".""]}   ADDITIONAL INFORMATION You can achieve the same modification with the awx-cli:  awx-cli setting modify AUTH_LDAP_USER_SEARCH '[""DC=example,DC=com"",""SCOPE_SUBTREE"",""(uid=%(user)s)""]' Resource changed.   id value   AUTH_LDAP_USER_SEARCH [u'DC=example,DC=com', u'SCOPE_SUBTREE', u'(uid=%(user)s)']",test-file | config-file | source-file
11622,awx,https://github.com/ansible/awx/issues/11622,Hop nodes instances can be modified,"Please confirm the following - [X] I agree to follow this project's [code of conduct](https://docs.ansible.com/ansible/latest/community/code_of_conduct.html). - [X] I have checked the [current issues](https://github.com/ansible/awx/issues) for duplicates. - [X] I understand that AWX is open source software provided for free and that I might not receive a timely response.  Summary After merging https://github.com/ansible/awx/pull/11591 the hop nodes are now exposed in `/api/v2/instances/`. Example:  { ""id"": 4, ""type"": ""instance"", ""url"": ""/api/v2/instances/4/"", ""related"": { ""jobs"": ""/api/v2/instances/4/jobs/"", ""instance_groups"": ""/api/v2/instances/4/instance_groups/"" }, ""uuid"": ""00000000-0000-0000-0000-000000000000"", ""hostname"": ""receptor-hop"", ""created"": ""2022-01-26T19:15:07.439405Z"", ""modified"": ""2022-01-26T19:27:58.447951Z"", ""last_seen"": ""2022-01-27T13:36:46.163205Z"", ""last_health_check"": null, ""errors"": """", ""capacity_adjustment"": ""1.00"", ""version"": """", ""capacity"": 0, ""consumed_capacity"": 0, ""percent_capacity_remaining"": 0.0, ""jobs_running"": 0, ""jobs_total"": 0, ""cpu"": 0, ""memory"": 0, ""cpu_capacity"": 0, ""mem_capacity"": 0, ""enabled"": false, ""managed_by_policy"": false, ""node_type"": ""hop"" }  and now is possible to `PUT` or `PATCH` the values through API  { ""capacity_adjustment"": ""1.00"", ""enabled"": false, ""managed_by_policy"": false }  although setting capacity to 0 enabld to false is not making the job to faul, @jbradberry do we want allow users to patch/put on hop node instances?  AWX version devel  Installation method docker on linux  Modifications no  Ansible version _No response_  Operating system _No response_  Web browser Chrome  Steps to reproduce 1. Go to /api/v2/instances/<id>/ 2. patch any value:  { ""capacity_adjustment"": 1.0, ""enabled"": true, ""managed_by_policy"": true }   Expected results These fields to be not modifyable for hop nodes?  Actual results 1. The user can change those values 2. This is not making the job to fail 3. The hop nodes instances are showing as `disabled` in the mesh view (may confuse users)  Additional information _No response_",source-file
