issue_no,repo,issue_url,title,description,patched_file_types
7798,awx,https://github.com/ansible/awx/issues/7798,Exported Workflow Job Templates refer to inventories by id instead of natural key,"ISSUE TYPE - The API endpoint for a workflow_job_template does not provide a representation that includes the natural key of the related Inventory, which is problematic when migrating it between different instances of AWX/Tower.  SUMMARY The API endpoint for a workflow_job_template does not provide a representation that includes the natural key of the related Inventory, if set. Instead, it just uses the numerical `id`, which is problematic when attempting to export and import the workflow between different instances of AWX/Tower, since the API will attempt to use the given numerical `id` to associate an inventory to the import workflow, which will most likely be different on the target instance of AWX/Tower. This behaviour is dangerous because if the target instance of AWX/Tower has a different inventory with the same numerical `id`, no warnings will be raised, causing the workflow to be associated with the wrong template.  ENVIRONMENT * AWX version: 3.7.1 (Tower) * AWX install method: openshift * Ansible version: 2.9.9 * Operating System: OpenShift * Web Browser: Google Chrome  STEPS TO REPRODUCE 1. Export a `workflow_job_template` that is associated with an inventory 2. Observe the value of the `workflow_job_templates.[].inventory` attribut in the exported YAML.  EXPECTED RESULTS It is reasonable to expect that the following YAML document would be generated for an example workflow_job_template object. yaml workflow_job_templates: - allow_simultaneous: true ask_inventory_on_launch: false ask_limit_on_launch: false ask_scm_branch_on_launch: true ask_variables_on_launch: true description: My VM provisioning extra_vars: '' inventory: name: my-vms type: inventory organization: name: ACME type: organization limit: null name: my-workflow natural_key: name: my-workflow organization: name: ACME type: organization type: workflow_job_template organization: name: ACME type: organization related: notification_templates_approvals: [] notification_templates_error: [] notification_templates_started: [] notification_templates_success: [] schedules: [] survey_spec: {} workflow_nodes: [] scm_branch: null survey_enabled: false webhook_credential: null  The document above, when imported, will generate the association with the inventory correctly on Tower 3.7.1. This is the expected behaviour, relying on the natural key of the object instead of the `id`.  ACTUAL RESULTS YAML such as the following is generated: yaml workflow_job_templates: - allow_simultaneous: true ask_inventory_on_launch: false ask_limit_on_launch: false ask_scm_branch_on_launch: true ask_variables_on_launch: true description: My VM provisioning extra_vars: '' inventory: 29 limit: null name: my-workflow natural_key: name: my-workflow organization: name: ACME type: organization type: workflow_job_template organization: name: ACME type: organization related: notification_templates_approvals: [] notification_templates_error: [] notification_templates_started: [] notification_templates_success: [] schedules: [] survey_spec: {} workflow_nodes: [] scm_branch: null survey_enabled: false webhook_credential: null  Notice that the `inventory` key has the value corresponding to the unique id on the source AWX/Tower server. This is not guaranteed to be the same on the target server when the object will be imported.",source-file
4573,awx,https://github.com/ansible/awx/issues/4573,CLI: Need general solution for dictionary-like inputs,"ISSUE TYPE - Bug Report  SUMMARY <!-- Briefly describe the problem. --> This is a general problem but I'm going to flesh out one particular use case for now: Currently, credential type creation does not accept inputs. New credential types need to have some kind of inputs in order to be of any use. Currently the CLI and APi have conflicting constraints on the `--inputs` flag so there is no way to pass itat least not that I could figure out.  STEPS TO REPRODUCE <!-- Please describe exactly how to reproduce the problem. --> Passing any type of dictionary like thing gets an error from the CLI saying it should be an integer:  awx credential_types create --name foo_cred_type1 --kind cloud --inputs=""\{'fields': [\{'id': 'password', 'label':'password', 'secret':true, 'type':'string'\}]\}"" usage: awx credential_types create [-h] --name TEXT [--description TEXT] --kind {net,cloud} [--inputs INPUTS] [--injectors INJECTORS] required arguments: --kind {net,cloud} [REQUIRED] optional arguments: -h, --help show this help message and exit --description TEXT Optional description of this credential type. --inputs INPUTS Enter inputs using either JSON or YAML syntax. Use the radio button to toggle between the two. Refer to the Ansible Tower documentation for example syntax. --injectors INJECTORS Enter injectors using either JSON or YAML syntax. Use the radio button to toggle between the two. Refer to the Ansible Tower documentation for example syntax. required arguments: --name TEXT [REQUIRED] Name of this credential type. awx credential_types create: argument --inputs: invalid int value: ""\\{'fields': [\\{'id': 'password', 'label':'password', 'secret':true, 'type':'string'\\}]\\}""  But if you pass an integer (which makes no sense), you get error from API:  awx credential_types create --name foo_cred_type1 --kind cloud --inputs=42 {""inputs"": [""int provided, expected dict""]}   EXPECTED RESULTS <!-- What did you expect to happen when running the steps above? --> Either have reasonable way provide `inputs` to the new credential_type or do not allow creation from command line. This is something we need to consider what a reasonable UX would be for specifying the new credential type inputs.",test-file | data-file | source-file
10123,awx,https://github.com/ansible/awx/issues/10123,AWX 19.1.0 - Job settings cannot be saved (/worker-json.js returns 404),"ISSUE TYPE - Bug Report  SUMMARY Job settings cannot be saved, probably due to the `worker-json.js` returning 404.  ENVIRONMENT * AWX version: 19.1.0 * AWX install method: minikube * OS: Debian * Browser: Chromium: 90.0.4430.93 (Official Build) (64-bit)  STEPS TO REPRODUCE - Go the Settings > Jobs settings > Edit - Tweak a setting - Hit Save  EXPECTED RESULTS - The settings are saved succesfully  ACTUAL RESULTS - The settings never get updated, the save button doesn't do anything  ADDITIONAL INFORMATION I am not sure what debug information would help, but I will be happy to provide any if required",source-file | test-file | documentation-file
5046,awx,https://github.com/ansible/awx/issues/5046,Child WorkflowJob not started when Inventory on WorkflowJobTemplateNode,"ISSUE TYPE - Bug Report  SUMMARY I have nested workflow templates, when I set Prompt on launch on child workflow template and set Inventory through ""Prompt"" in Workflow visualizer, then Launch is in Running state forever and Workflow job for child Workflow template doesn't exist (is probably deleted, because there is missing ID in list of Jobs)  ENVIRONMENT * AWX version: Tower 3.5.0 * AWX install method: AMI - https://www.ansible.com/products/tower/trial - Tower in Amazon EC2 * Ansible version: 2.8.0 * Operating System: * Web Browser: Google Chrome 77.0.3865.120  STEPS TO REPRODUCE Child Workflow template contains: - No inventory, Prompt on launch - Job Template with https://github.com/mkanoor/playbook/blob/master/hello_world.yml - No inventory, Prompt on launch - Workflow Job Template Node with Inventory1 (added through ""Prompt"" button in Workflow visualizer) Parent Workflow template contains: - No inventory - Child workflow - (No inventory, Prompt on Launch) - Workflow Job Template Node with Inventory2 (added through ""Prompt"" button in Workflow visualizer)  Parent Workflow (without Inventory) (Start) ==> (Inventory2 on Workflow Node) ==> [ Child Workflow (without Inventory, Prompt on Launch) => (Start) ==> (Inventory1 on Workflow Node) ==> Job Template with Prompt on Launch ]   EXPECTED RESULTS Job Template should be successfully finished (I suppose with Inventory2?)  ACTUAL RESULTS Parent workflow job Status = Running forever Child workflow job doesn't exist (probably deleted, one ID in Jobs is missing) API: (the only node) in `api/workflow_jobs/<parent_workflow_id>/workflow_nodes` doesn't have `/summary_fields/job`, also `/related/job` doesn't exist. But there are `/summary_fields/inventory` and `/related/inventory`. Parent workflow doesn't have inventory In another case that Parent workflow has inventory and workflow node doesn't have, then `/summary_fields/job` and `/related/job` links exist and point to child workflow.  ADDITIONAL INFORMATION <!-- Include any links to sosreport, database dumps, screenshots or other information. -->",test-file | source-file
11505,awx,https://github.com/ansible/awx/issues/11505,Cannot create manual project in Japanese (possibly all non-English languages),Please confirm the following - [X] I agree to follow this project's [code of conduct](http://docs.ansible.com/ansible/latest/community/code_of_conduct.html). - [X] I have checked the [current issues](https://github.com/ansible/awx/issues) for duplicates. - [X] I understand that AWX is open source software provided for free and that I am not entitled to status updates or other assurances.  Summary _No response_  AWX version 19.5.0  Installation method docker for mac  Modifications no  Ansible version _No response_  Operating system _No response_  Web browser _No response_  Steps to reproduce 1. Compile strings 2. Start up AWX 3. Set default browser language to Japanese (UI should now render in Japanese for translated strings) 4. Attempt to create a manual project  Expected results A manual project is created  Actual results Project creation fails  Additional information I suspect that we are sending the translated string back to the API rather than `manual` which is what it is expecting.,source-file
8305,awx,https://github.com/ansible/awx/issues/8305,500 error when attempting to delete workflow approval,"ISSUE TYPE - Bug Report  SUMMARY ![delete_wf_approval](https://user-images.githubusercontent.com/9889020/94853438-67e91280-03f9-11eb-9233-63c15e611f70.gif) I haven't tried this with a pending workflow approval but I suspect it would yield the same result. We don't have an interface that interacts with this endpoint in the UI so maybe this has been around for a while? I'm exploring adding an interface for listing out _all_ workflow approvals so that a user could go back and see who approved/denied what in the past. This interface will support deletion if the API allows it.  STEPS TO REPRODUCE 1) Create a workflow with an approval step 2) Launch workflow 3) Approve step 4) Attempt to delete workflow approval via API  EXPECTED RESULTS Successful delete  ACTUAL RESULTS 500 error  Request Method: | DELETE -- | -- https://localhost:8043/api/v2/workflow_approvals/3/ 2.2.16 AttributeError 'NoneType' object has no attribute 'objects' ./awx/main/models/unified_jobs.py in get_event_queryset, line 994 /venv/awx/bin/uwsgi 3.6.8 ['/venv/awx/lib/python3.6/site-packages/git/ext/gitdb', '.', '', '/venv/awx/lib64/python36.zip', '/venv/awx/lib64/python3.6', '/venv/awx/lib64/python3.6/lib-dynload', '/usr/lib64/python3.6', '/usr/lib/python3.6', '/venv/awx/lib/python3.6/site-packages', '/venv/awx/lib/python3.6/site-packages/gitdb/ext/smmap'] Thu, 1 Oct 2020 19:17:11 +0000",source-file
4492,awx,https://github.com/ansible/awx/issues/4492,API/SDK configure CUSTOM_LOGO doesn't take affect,"ISSUE TYPE - Bug Report  SUMMARY When utilizing the UI, one can head to Settings/UI and upload an image file. This ""replaces"" the Image file on the login screen. One can also view this image in a ""data:url"" format at api/v2/settings/ui CUSTOM_LOGO: ""data:image/png;base64,Base64EncodedStringhere="" Attempting the same via the API or tower-cli (example below) produces no ""error"" and updates the CUSTOM_LOGO attribute properly when viewed in the API, but doesn't actually ""take effect"" in that the logo is not actually changed at login.  ENVIRONMENT * AWX version: 6.1.0 * AWX install method: openshift * Ansible version: Whatever comes built-in with 6.1.0's ansible virtualenv * Operating System: Openshift 3.11 running on RHEL 7.6 * Web Browser: Firefox  STEPS TO REPRODUCE Reproduce using the tower-cli:  with open(""/path/to/a/png/file.png, 'rb') as logofile: logo_64_encode = base64.b64encode(logofile.read()).decode() created_data_url = 'data:image/png;base64,{}'.format(logo_64_encode) # Placeholder: Setup AWX auth - however you do it since there's 10,000 ways # Set a bunch of other settings as examples - these all WORK FINE # Assuming you have some valid data in login_message and custom_venv_paths variables settings_resource.modify('CUSTOM_LOGIN_INFO', login_message) settings_resource.modify('CUSTOM_VENV_PATHS', json.dumps(custom_venv_paths)) # Setup AWX Custom Logo using above data:url - this shows a successful return and updates CUSTOM_LOGO - but never displays settings_resource.modify('CUSTOM_LOGO', created_data_url)   EXPECTED RESULTS if the tower-cli call succeeded (no errors) an i can see the encoded data:url in CUSTOM_LOGO - i would expect a Custom Image to be displayed at the login prompt.  ACTUAL RESULTS No image is displayed. Uploading the same image via the UI's ""browse"" option causes it to display immediately, same apparent data:url object written to CUSTOM_LOGO  ADDITIONAL INFORMATION N/A",source-file
6464,awx,https://github.com/ansible/awx/issues/6464,Survey multiple choice options need improvements and error handling,"ISSUE TYPE - Bug Report  SUMMARY From https://github.com/ansible/awx/issues/5900#issuecomment-605008285: cc @keithjgrant > Both add and edit forms for JT surveys need some way of clarifying how to format single-select and multi-select options. It is trivial to create modal-overlay 400 errors with the basic input textbox given, and these 400 errors do not provide any useful information to the end user.  STEPS TO REPRODUCE Put bad input into a job template survey with either single or multi-select. semicolons in random spots, etc, in an attempt to break it. some things work, some don't.  EXPECTED RESULTS Form validation on submission that keeps you on the form page, indicating formatting errors or something similar when met with a 400 error. I would also like information around the box about how to format the survey.  ACTUAL RESULTS 400 that takes you back to the survey list, no further information about the error.",test-file | data-file | source-file
5099,awx,https://github.com/ansible/awx/issues/5099,Default for webhook_service is not in field choices and not accepted,"ISSUE TYPE - Bug Report  SUMMARY The OPTIONS for job_templates is not self-consistent for the field `webhook_service`. This breaks the `tower-cli send` command, assuming the data comes from the receive command. A hack is in progress for this, but it would be better to change behavior from API moving forward.  ENVIRONMENT * AWX version: 8.0.0 * AWX install method: N/A * Ansible version: N/A * Operating System: * Web Browser:  STEPS TO REPRODUCE Of particular interest here is the sequence of `tower-cli receive`, saving that to a file, and using it in `tower-cli send`.  EXPECTED RESULTS Data given from the API is consistent with OPTIONS  ACTUAL RESULTS OPTIONS for job_templates gives json ""webhook_service"": { ""type"": ""choice"", ""label"": ""Webhook service"", ""help_text"": ""Service that webhook requests will be accepted from"", ""filterable"": true, ""choices"": [ [ ""github"", ""GitHub"" ], [ ""gitlab"", ""GitLab"" ] ]  The receive command always gives `webhook_credential` in the asset data because it has no default. Without a default, it cannot be determined if the field has been set. The send command gives  JOB TEMPLATE [SRtest]  Value is not a valid choice for option webhook_service for job_template SRtest. Options: ['github', 'GitHub', 'gitlab', 'GitLab']   ADDITIONAL INFORMATION https://github.com/ansible/tower-cli/pull/741 Ping @jbradberry, @john-westcott-iv In terms of CLI design in general, @ryanpetrello I find the ability to determine if a field has a non-default value is a powerful tool. This is one of the things I most like about the send/receive commands. I would even prefer that for compact representations of resources for human consumption.",source-file
6332,awx,https://github.com/ansible/awx/issues/6332,Getting a 400 error when Credential Add/Edit has an invalid SSH Private Key field,"ISSUE TYPE - Bug Report  SUMMARY When a invalid SSH Private Key is specified, getting a 400 error instead of an error under the field that the value is invalid  STEPS TO REPRODUCE 1. Add/Edit a credential 2. select any of the credential type 2. Enter an invalid value for the SSH Private Key  EXPECTED RESULTS It should say that the value is invalid under the field  ACTUAL RESULTS Getting a 400 error ![Screen Shot 2020-03-18 at 1 19 38 PM](https://user-images.githubusercontent.com/11617351/76988490-255b5f00-691b-11ea-848a-8c48233e987b.png)",source-file
9441,awx,https://github.com/ansible/awx/issues/9441,Advanced search for type returns 400,"<!-- Issues are for **concrete, actionable bugs and feature requests** only - if you're just asking for debugging help or technical support, please use: - http://webchat.freenode.net/?channels=ansible-awx - https://groups.google.com/forum/#!forum/awx-project We have to limit this because of limited volunteer time to respond to issues! -->  ISSUE TYPE - Bug Report  SUMMARY Trying to do an advanced search by `type` the results are always `ExecutionEnvironment has no field named 'type'`: ![image](https://user-images.githubusercontent.com/12464858/109544586-83d70a00-7aa6-11eb-994c-dedcbce8801a.png)",data-file
4943,awx,https://github.com/ansible/awx/issues/4943,System Auditor is unable to view Container Groups,ISSUE TYPE - Bug Report  SUMMARY System Auditor is unable to view Container Groups  ENVIRONMENT * AWX version: 7.0.0  STEPS TO REPRODUCE 1. Create Container Group 2. Log in as System Auditor 3. Attempt to view a container group  EXPECTED RESULTS Able to view container group like an instance group  ACTUAL RESULTS Unable to view container group  ADDITIONAL INFORMATION ![Screen Shot 2019-10-08 at 5 32 17 PM](https://user-images.githubusercontent.com/12446869/66435218-5c375b80-e9f2-11e9-8abb-0be7ba30ad30.png),source-file
8202,awx,https://github.com/ansible/awx/issues/8202,Launching job with vault password 400s when default machine cred is replaced,"ISSUE TYPE - Bug Report  SUMMARY Really odd behavior that I came across while building out credential prompting in the new UI. This can be reproduced via the API browser though. I created a JT with a default machine credential (that prompted for some passwords) and a default vault credential (that prompted for password). If I swap the machine credential for one that does not prompt for a password then the API responds with a 400 on launch complaining about the vault password: `{""passwords_needed_to_start"":[""vault_password.A""]}` In the example below credential with ID = 1 is the machine credential that prompts for ssh and become passwords. Credential ID = 2 is the machine credential that does not prompt for passwords. Credential ID = 4 is the vault credential that prompts for password. A normal launch without changing credentials: ![good_launch](https://user-images.githubusercontent.com/9889020/93922608-26ad8000-fce0-11ea-8b61-8604ec329d83.gif) A launch where I change the machine credential: ![bad_launch](https://user-images.githubusercontent.com/9889020/93922684-493f9900-fce0-11ea-93a5-891b46041a13.gif)",test-file | source-file
9373,awx,https://github.com/ansible/awx/issues/9373,[ui_next] Silent error when creating or editing an inventory source to 'Update on launch' and 'Update on project update',"ISSUE TYPE - Bug Report  SUMMARY When creating or editing an inventory which is sourced from a project, if the 'Update on launch' and 'Update on project update' options are selected, the form does not save and the API's error response does not get displayed in the UI.  {""update_on_launch"":[""Cannot update SCM-based inventory source on launch if set to update on project update. Instead, configure the corresponding source project to update on launch.""]}  I think the fix for this should be two parts: 1. Update the tooltips for both toggles to note that they cannot be used simultaneously 2. Surface API errors to user on save, generally.  STEPS TO REPRODUCE 1. Create an Inventory with type 'Sourced from a Project' 2. Select both 'Update on launch' or 'Update on project update' 3. Save Note: error in console",test-file | source-file
6630,awx,https://github.com/ansible/awx/issues/6630,refresh token does not expire,"ISSUE TYPE - Bug Report  SUMMARY Using password grant type, refresh token does not expire according to `REFRESH_TOKEN_EXPIRE_SECONDS`.  ENVIRONMENT * AWX version: 10.0.0 * AWX install method: docker on linux * Operating System: CentOS v8 * Web Browser: Chrome  STEPS TO REPRODUCE Set the expiry times low from AWX GUI > Settings > System Confirm the settings from api  https://x.x.x.x/api/v2/settings/all/   ""OAUTH2_PROVIDER"": { ""ACCESS_TOKEN_EXPIRE_SECONDS"": 10, ""REFRESH_TOKEN_EXPIRE_SECONDS"": 10, ""AUTHORIZATION_CODE_EXPIRE_SECONDS"": 600 },  Create an Application from the GUI of Authorization Grant Type `Resource owner password-based`. Save a copy of the `clientId` and `clientSecret`. Create the access and refresh tokens using password grant: bash curl -v -k -X POST -d \ ""grant_type=password&username=someuser&password=somepassword&scope=read"" \ -u ""clientId:clientSecret"" https://x.x.x.x/api/o/token/ -i  Which returns json {""access_token"": ""Ma5cLFKYs1Q8iknITJjAe0VXJyiUVP"", ""expires_in"": 10, ""token_type"": ""Bearer"", ""scope"": ""read"", ""refresh_token"": ""IymTfQp0JtT3HtDUitoAj7eaxXr3zM""}  Wait at least 20 seconds and try use refresh token  curl -k -X POST -d \ ""grant_type=refresh_token&refresh_token=IymTfQp0JtT3HtDUitoAj7eaxXr3zM"" \ -u ""clientId:clientSecret"" https://x.x.x.x/api/o/token/ -i  That previous refresh token continues to generate new `access_token` and new `refresh_token` after 20 seconds. Even after I waited 12 hours it still worked. I also tried manually adding the settings to `/etc/tower/settings.py` of the docker container.  OAUTH2_PROVIDER = {'ACCESS_TOKEN_EXPIRE_SECONDS': 10, 'REFRESH_TOKEN_EXPIRE_SECONDS': 10, 'AUTHORIZATION_CODE_EXPIRE_SECONDS': 600}  and restarting the container.  EXPECTED RESULTS The refresh token should have failed to generate a new access token and returned an error message after more than 10 + 10 seconds.  ACTUAL RESULTS The last refresh token still generates a new `access_token` and new `refresh_token` after 20 seconds. I waited 12 hours and the last generated refresh token still works. So it appears to ignore the refresh token expiry time.  ADDITIONAL INFO Should the refresh token stay the same each time it is used? Current behavior is that a new refresh token is generated each time it is used. The previous one no longer works. So the way it works currently, refresh tokens are one-time use only.",test-file | source-file
13429,awx,https://github.com/ansible/awx/issues/13429,admin_role disassociated despite remove_admins = false,"Please confirm the following - [X] I agree to follow this project's [code of conduct](https://docs.ansible.com/ansible/latest/community/code_of_conduct.html). - [X] I have checked the [current issues](https://github.com/ansible/awx/issues) for duplicates. - [X] I understand that AWX is open source software provided for free and that I might not receive a timely response.  Bug Summary After upgrading from AWX 21.5.1 to 21.10.2 all organization admin roles were removed from the users' accounts. We're using LDAP with an organization map looking like this:  { ""Org1"": { ""admins"": false, ""remove_admins"": false, ""remove_users"": true, ""users"": [ ""CN="" ] } }  Users were manually granted the organization admin role. That had worked before, but after the upgrade, the role was removed from the users with the following activity message:  | 13.1.2023, 14:10:40 | system | disassociated Org1 admin_role from jdoe  And AWX was logging the following:  DEBUG [4ecb27399afb4cb7b9ad2fd5e666a8ca] awx.sso.backends LDAP adapter removing user jdoe permission of admin_role from organization Org1  I tried to remove '""admins"": false' from the config or replace it with an empty list ('admins"": [],') but that didn't change anything. ""None"" was not accepted by the form. According to the Automation Platform docs that should work: https://docs.ansible.com/automation-controller/4.2.1/html/administration/social_auth.html#organization-mapping This seems to be related to the following PR: https://github.com/ansible/awx/pull/12949  AWX version 21.10.2  Select the relevant components - [ ] UI - [X] API - [ ] Docs - [ ] Collection - [ ] CLI - [ ] Other  Installation method docker development environment  Modifications no  Ansible version 2.12.2  Operating system Debian 11  Web browser Firefox  Steps to reproduce 1) Add default LDAP settings 2) Create an organization map with ""admins: false"" 3) Add a user manually as organization admin to an organization 4) Login with that user and recognize that the admin_role was removed  Expected results The system doesn't remove the admin_role from the user.  Actual results The admin_role is removed from the user  Additional information _No response_",source-file
