issue_no,repo,issue_url,title,description,patched_file_types
6498,awx,https://github.com/ansible/awx/issues/6498,504 timeouts when fetching job_events for a running job,"ISSUE TYPE - Bug Report  SUMMARY Having issues with 504 timeouts on `job_events` APIs for a given host when a job is running, e.g. `api/v2/hosts/1/job_events/`. Maybe due to deadlocks? **EDIT**: We redeployed `awx_web` to see if we could make the APIs work again, still 504 timeout on every `api/v2/hosts/1/job_events/` request. Something is very wrong here.  ENVIRONMENT * AWX version: 9.3.0 * AWX install method: openshift manual deployment * Ansible version: 2.9.5 * Operating System: Official AWX images * Web Browser: Firefox, postman, Python's `request.get()` (from both a Linux and Mac client)  STEPS TO REPRODUCE 1. Start a task that takes long time to finish (Our task is a task that writes hundreds of commands on a device and takes about 8 minutes to finish) 2. Fetch job events API while task is running 3. 504 timeouts on that API even after the job is done for a loong time. (It did start responding again earlier, but now I've waited 10 minutes and still no response from the API). It's important to note that when this occurs we get sporadic 504's on other endpoints too, but I believe this may happen due to sync workers and not enough of them.  EXPECTED RESULTS Being able to fetch `job_events` when a task is running.  ACTUAL RESULTS Timeout on `job_events`.  ADDITIONAL INFORMATION We found #6108 and disabled external logging to Logstash, but don't seem like the issue was solved. The timeout is happening due to OpenShift cutting the connection (499), but the request should never take more than 30 seconds anyway: ![image](https://user-images.githubusercontent.com/5310116/78008928-926dec00-7340-11ea-82e8-877aedbe2b17.png)",source-file
8641,awx,https://github.com/ansible/awx/issues/8641,Cannot disable a schedule for a JT with a missing project (and it keeps running),"ISSUE TYPE - Bug Report  SUMMARY It's fairly easy to get into a state where a schedule is enabled with an invalid JT, and the schedule cannot be turned off, due to a validation error on the JT. Even though the schedule is invalid, it keeps running on the schedule interval, and its jobs fail obviously.  ENVIRONMENT * AWX version: 15.0.1  STEPS TO REPRODUCE Create a JT Create a 1-minute schedule for that JT Delete the project used by the JT (or its inventory) Try to disable the schedule in the UI  EXPECTED RESULTS Schedule turns off  ACTUAL RESULTS 400 response json {""resources_needed_to_start"":[""Job Template project is missing or undefined."",""Job Template inventory is missing or undefined.""]}  This is what you get hitting the disable button in the UI, which performs a PATCH to the schedule, setting the ""enabled"" field to False, and it includes the rest of the data. The issue is on the API here, because the request made by the UI seems reasonable, and should be expected to succeed. Perhaps the API should only error on this type of validation if the schedule is being _enabled_.  ADDITIONAL INFORMATION Similar to https://github.com/ansible/awx/issues/7521 by @chrismeyersfsu, seen in test runs, and creates background processing since the 1-minute schedule continues to run for the duration that the server is up.",source-file
5882,awx,https://github.com/ansible/awx/issues/5882,API Provides credential_type for WFJTs,"ISSUE TYPE Bug maybe?  SUMMARY Missing information in the WFJT end point re: webhook credentials. JobTemplates end point provides credential type and kind information, but WFJT end point does not provide that info for webhook credentials. It would be nice to have.  ENVIRONMENT * AWX version: 9.1.1 * AWX install method: docker for mac * Ansible version: 2.10 * Operating System: Mojave * Web Browser: Chrome  STEPS TO REPRODUCE Generate a workflow JT with a webhook credential. Go to api gui for that WFJT  EXPECTED RESULTS Credential type and credential kind info would be provided.  ACTUAL RESULTS Credential type and credential kind are not provided at that end point when all the other info for the template is provided.",source-file
6049,awx,https://github.com/ansible/awx/issues/6049,Inventory Group Nested Hosts View errors with a 404,"ISSUE TYPE - Bug Report  SUMMARY I searched for implemented issues and couldn't find anything. /inventories/inventory/*num*/groups/*num*/nested_hosts isn't loading in ui_next  ENVIRONMENT * AWX version: 9.next  STEPS TO REPRODUCE 1. Create an Inventory Group with nested hosts 2. View the #/inventories/inventory/*num*/groups/*num*/nested_hosts page  EXPECTED RESULTS Nested Hosts to be displayed  ACTUAL RESULTS 404 messaging page  ADDITIONAL INFORMATION <img width=""1159"" alt=""Screen Shot 2020-02-25 at 9 10 38 AM"" src=""https://user-images.githubusercontent.com/12446869/75254948-29c6a900-57af-11ea-92c0-7d35dee281c6.png"">",source-file
4541,awx,https://github.com/ansible/awx/issues/4541,Notifications - missing hosts with webhook notification,"ISSUE TYPE - Bug Report  SUMMARY We have around 400 hosts in the inventory, however, the notification webhook endpoint receives notification about only around 40-50 hosts. (Sometimes it's working fine reporting all the hosts.)  ENVIRONMENT * AWX version: 6.1.0.0 (Same problem with 6.0.0.0) * AWX install method: docker on linux (official image from docker hub) * Ansible version: 2.8.2 * Operating System: Centos7 * Web Browser: Chrome  STEPS TO REPRODUCE - Create a webhook notification - Start a job (or job-flow), enable notifications.  EXPECTED RESULTS Report from all the hosts in JSON format  ACTUAL RESULTS Most of the times only partial host list in the report, sometimes full list. Differs in a job-flow, some jobs reporting about all hosts, some only about a few) Workflow with 2 jobs: Number of hosts, on which the job ran (reported in AWX): 438 Number of hosts reported on the webhook script: 53  ADDITIONAL INFORMATION I also have the same problem with 6.0.0.0 and 6.1.0.0 I tried with different users, with standalon jobs or woth flows, also with different playbooks, the problem looks pretty consistent. Thx",source-file
12046,awx,https://github.com/ansible/awx/issues/12046,Disable isCreatable for Select component on Advanced Search,"SUMMARY Disable isCreatable for Select component on Advanced Search. This prop leads to invalid API searches. <img width=""1496"" alt=""image"" src=""https://user-images.githubusercontent.com/9053044/163234927-b4b0c433-435e-4a28-923a-26eafa17f8ef.png""> <img width=""1498"" alt=""image"" src=""https://user-images.githubusercontent.com/9053044/163234857-a07d7a9a-1da5-41f9-8ae5-e23213f877ca.png"">",source-file
13439,awx,https://github.com/ansible/awx/issues/13439,CyberArk Conjur lookup plugin does not work with open source Conjur version,"Please confirm the following - [X] I agree to follow this project's [code of conduct](https://docs.ansible.com/ansible/latest/community/code_of_conduct.html). - [X] I have checked the [current issues](https://github.com/ansible/awx/issues) for duplicates. - [X] I understand that AWX is open source software provided for free and that I might not receive a timely response.  Bug Summary The CyberArk Conjur Secrets Manager Lookup plugin no longer supports the lookup against the Conjur OSS. Most likely because the opensource conjure version API endpoint does not have the `/api/` portion recently added by this change: https://github.com/ansible/awx/pull/13121  AWX version 2.4  Select the relevant components - [ ] UI - [X] API - [ ] Docs - [ ] Collection - [ ] CLI - [ ] Other  Installation method docker development environment  Modifications no  Ansible version _No response_  Operating system _No response_  Web browser _No response_  Steps to reproduce 1. Deploy Conjur OSS. We use the latest `cyberark/conjur` image for that. The Conjur version is  Version 1.19.1-3398 API Version 5.3.0  2. Under the AWX, create the CyberArk Conjur Secrets Manager Lookup credential. Provide Conjure URL, user, and token. 3. Click Test and provide a path.  Expected results Connection to Conjur should be established. HTTP 200 response.  Actual results 401 error returned.  Traceback (most recent call last): File ""/var/lib/awx/venv/awx/lib64/python3.9/site-packages/awx/main/tasks/jobs.py"", line 504, in run args = self.build_args(self.instance, private_data_dir, passwords) File ""/var/lib/awx/venv/awx/lib64/python3.9/site-packages/awx/main/tasks/jobs.py"", line 937, in build_args ssh_username = creds.get_input('username', default='') File ""/var/lib/awx/venv/awx/lib64/python3.9/site-packages/awx/main/models/credential/__init__.py"", line 275, in get_input return self._get_dynamic_input(field_name) File ""/var/lib/awx/venv/awx/lib64/python3.9/site-packages/awx/main/models/credential/__init__.py"", line 309, in _get_dynamic_input return input_source.get_input_value() File ""/var/lib/awx/venv/awx/lib64/python3.9/site-packages/awx/main/models/credential/__init__.py"", line 1250, in get_input_value return backend(**backend_kwargs) File ""/var/lib/awx/venv/awx/lib64/python3.9/site-packages/awx/main/credential_plugins/conjur.py"", line 72, in conjur_backend raise_for_status(resp) File ""/var/lib/awx/venv/awx/lib64/python3.9/site-packages/awx/main/credential_plugins/plugin.py"", line 12, in raise_for_status resp.raise_for_status() File ""/var/lib/awx/venv/awx/lib64/python3.9/site-packages/requests/models.py"", line 1021, in raise_for_status raise HTTPError(http_error_msg, response=self) requests.exceptions.HTTPError: 401 Client Error: Unauthorized for url: https://conjureurl.com/api/authn/test/admin/authenticate   Additional information _No response_",source-file
8777,awx,https://github.com/ansible/awx/issues/8777,awx collection workflow approval with success node fail,"ISSUE TYPE - Bug Report  SUMMARY apply success node to approval_node fail because success_nodes not exists in /api/v2/workflow_approval_templates/ ""msg"": ""The requested object could not be found at /api/v2/workflow_approval_templates/280/success_nodes/.""  ENVIRONMENT * AWX version: 15.0.1 * AWX install method: docker * Ansible version: 2.8.7 * Operating System: redhat * Web Browser: chrome  STEPS TO REPRODUCE approval_node with success_node  EXPECTED RESULTS ansible tasks changed  ACTUAL RESULTS ansible fail  ADDITIONAL INFORMATION",data-file | source-file
5717,awx,https://github.com/ansible/awx/issues/5717,awx cli schedules create cannot create schedule if the user is of type Normal User with required permissions.,"ISSUE TYPE - Bug Report  SUMMARY awx cli schedules create cannot create schedule if the user is of type Normal User with required permissions on the object or even with Organization admin role. Currently the user needs to be a System Administrator type to create the schedule. From the UI the Normal User with permission can create the schedule. POST at the /api/v2/schedules/ endpoint is only available for the user with System Administrator type which is the endpoint used by awx schedules create command.  ENVIRONMENT * AWX version: Tower 3.6.2 * AWX install method: Tower 3.6.2 cluster installed with online installer * Ansible version: 2.9.1 * Operating System: RHEL 8 * Web Browser: Chrome 79  STEPS TO REPRODUCE * Create a normal user: * Assign permission to a job template or set the user role as Organization admin. * Try to create the schedule for the job template using awx cli.  awx --conf.host https://tower.ishwar.io --conf.username test --conf.password 'PASSWORD' schedules create --name=test --unified_job_template=111 --rrule=""DTSTART;TZID=America/New_York:20180208T221500 RRULE:FREQ=MONTHLY;INTERVAL=1;BYDAY=TH;BYSETPOS=3"" -vvv  * Change the user type to system administrator and rerun the command.  EXPECTED RESULTS  DEBUG:urllib3.connectionpool:Starting new HTTPS connection (1): tower.ishwar.io:443 DEBUG:urllib3.connectionpool:https://tower.ishwar.io:443 ""GET /api/ HTTP/1.1"" 200 188 DEBUG:awxkit.api.client:""GET https://tower.ishwar.io/api/"" elapsed: 0:00:00.208793 DEBUG:awxkit.api.registry:Retrieved <class 'awxkit.api.pages.api.ApiV2'> by url: /api/v2/ DEBUG:urllib3.connectionpool:https://tower.ishwar.io:443 ""GET /api/v2/ HTTP/1.1"" 200 1688 DEBUG:awxkit.api.client:""GET https://tower.ishwar.io/api/v2/"" elapsed: 0:00:00.047443 DEBUG:urllib3.connectionpool:https://tower.ishwar.io:443 ""GET /api/ HTTP/1.1"" 200 188 DEBUG:awxkit.api.client:""GET https://tower.ishwar.io/api/"" elapsed: 0:00:00.052170 DEBUG:urllib3.connectionpool:https://tower.ishwar.io:443 ""POST /api/login/ HTTP/1.1"" 302 0 DEBUG:awxkit.api.client:""POST https://tower.ishwar.io/api/login/"" elapsed: 0:00:00.247407 DEBUG:urllib3.connectionpool:https://tower.ishwar.io:443 ""GET /api/ HTTP/1.1"" 200 188 DEBUG:awxkit.api.client:""GET https://tower.ishwar.io/api/"" elapsed: 0:00:00.080558 DEBUG:urllib3.connectionpool:https://tower.ishwar.io:443 ""GET /api/ HTTP/1.1"" 200 188 DEBUG:awxkit.api.client:""GET https://tower.ishwar.io/api/"" elapsed: 0:00:00.084587 DEBUG:awxkit.api.registry:Retrieved <class 'awxkit.api.pages.schedules.Schedules'> by url: /api/v2/schedules/ DEBUG:urllib3.connectionpool:https://tower.ishwar.io:443 ""OPTIONS /api/v2/schedules/ HTTP/1.1"" 200 13449 DEBUG:awxkit.api.client:""OPTIONS https://tower.ishwar.io/api/v2/schedules/"" elapsed: 0:00:00.101736 DEBUG:awxkit.api.registry:Retrieved <class 'awxkit.api.pages.schedules.Schedules'> by url: /api/v2/schedules/ DEBUG:urllib3.connectionpool:https://tower.ishwar.io:443 ""OPTIONS /api/v2/schedules/1/ HTTP/1.1"" 200 7915 DEBUG:awxkit.api.client:""OPTIONS https://tower.ishwar.io/api/v2/schedules/1/"" elapsed: 0:00:00.120726 awx: unrecognized arguments: -vvv DEBUG:awxkit.api.registry:Retrieved <class 'awxkit.api.pages.schedules.Schedules'> by url: /api/v2/schedules/ DEBUG:urllib3.connectionpool:https://tower.ishwar.io:443 ""POST /api/v2/schedules/ HTTP/1.1"" 201 1552 DEBUG:awxkit.api.client:""POST https://tower.ishwar.io/api/v2/schedules/"" elapsed: 0:00:00.156802 DEBUG:awxkit.api.registry:Retrieved <class 'awxkit.api.pages.schedules.Schedules'> by url: /api/v2/schedules/ { ""rrule"": ""DTSTART;TZID=America/New_York:20180208T221500 RRULE:FREQ=MONTHLY;INTERVAL=1;BYDAY=TH;BYSETPOS=3"", ""id"": 14, ""type"": ""schedule"", ""url"": ""/api/v2/schedules/14/"", ""summary_fields"": { ""unified_job_template"": { ""id"": 111, ""name"": ""test-schedule"", ""description"": """", ""unified_job_type"": ""job"" }, ""created_by"": { ""id"": 121, ""username"": ""test"", ""first_name"": ""test"", ""last_name"": ""test"" }, ""modified_by"": { ""id"": 121, ""username"": ""test"", ""first_name"": ""test"", ""last_name"": ""test"" }, ""user_capabilities"": { ""edit"": true, ""delete"": true }, ""inventory"": { ""id"": 29, ""name"": ""Demo Inventory"", ""description"": """", ""has_active_failures"": false, ""total_hosts"": 1, ""hosts_with_active_failures"": 0, ""total_groups"": 0, ""groups_with_active_failures"": 0, ""has_inventory_sources"": false, ""total_inventory_sources"": 0, ""inventory_sources_with_failures"": 0, ""organization_id"": 1, ""kind"": """", ""insights_credential_id"": null } }, ""created"": ""2020-01-21T07:31:19.312383Z"", ""modified"": ""2020-01-21T07:31:19.312398Z"", ""name"": ""test"", ""description"": """", ""extra_data"": {}, ""inventory"": null, ""scm_branch"": null, ""job_type"": null, ""job_tags"": null, ""skip_tags"": null, ""limit"": null, ""diff_mode"": null, ""verbosity"": null, ""unified_job_template"": 111, ""enabled"": true, ""dtstart"": ""2018-02-16T03:15:00Z"", ""dtend"": null, ""next_run"": ""2020-02-21T03:15:00Z"", ""timezone"": ""America/New_York"", ""until"": """" }   ACTUAL RESULTS  DEBUG:urllib3.connectionpool:Starting new HTTPS connection (1): tower.ishwar.io:443 DEBUG:urllib3.connectionpool:https://tower.ishwar.io:443 ""GET /api/ HTTP/1.1"" 200 188 DEBUG:awxkit.api.client:""GET https://tower.ishwar.io/api/"" elapsed: 0:00:00.173558 DEBUG:awxkit.api.registry:Retrieved <class 'awxkit.api.pages.api.ApiV2'> by url: /api/v2/ DEBUG:urllib3.connectionpool:https://tower.ishwar.io:443 ""GET /api/v2/ HTTP/1.1"" 200 1688 DEBUG:awxkit.api.client:""GET https://tower.ishwar.io/api/v2/"" elapsed: 0:00:00.046141 DEBUG:urllib3.connectionpool:https://tower.ishwar.io:443 ""GET /api/ HTTP/1.1"" 200 188 DEBUG:awxkit.api.client:""GET https://tower.ishwar.io/api/"" elapsed: 0:00:00.050566 DEBUG:urllib3.connectionpool:https://tower.ishwar.io:443 ""POST /api/login/ HTTP/1.1"" 302 0 DEBUG:awxkit.api.client:""POST https://tower.ishwar.io/api/login/"" elapsed: 0:00:00.247518 DEBUG:urllib3.connectionpool:https://tower.ishwar.io:443 ""GET /api/ HTTP/1.1"" 200 188 DEBUG:awxkit.api.client:""GET https://tower.ishwar.io/api/"" elapsed: 0:00:00.088723 DEBUG:urllib3.connectionpool:https://tower.ishwar.io:443 ""GET /api/ HTTP/1.1"" 200 188 DEBUG:awxkit.api.client:""GET https://tower.ishwar.io/api/"" elapsed: 0:00:00.081436 DEBUG:awxkit.api.registry:Retrieved <class 'awxkit.api.pages.schedules.Schedules'> by url: /api/v2/schedules/ DEBUG:urllib3.connectionpool:https://tower.ishwar.io:443 ""OPTIONS /api/v2/schedules/ HTTP/1.1"" 200 11598 DEBUG:awxkit.api.client:""OPTIONS https://tower.ishwar.io/api/v2/schedules/"" elapsed: 0:00:00.088985 DEBUG:awxkit.api.registry:Retrieved <class 'awxkit.api.pages.schedules.Schedules'> by url: /api/v2/schedules/ DEBUG:urllib3.connectionpool:https://tower.ishwar.io:443 ""OPTIONS /api/v2/schedules/1/ HTTP/1.1"" 200 6065 DEBUG:awxkit.api.client:""OPTIONS https://tower.ishwar.io/api/v2/schedules/1/"" elapsed: 0:00:00.112443 usage: awx schedules [-h] action  positional arguments: action list get modify delete optional arguments: -h, --help show this help message and exit awx schedules: argument action: invalid choice: 'create' (choose from 'list', 'get', 'modify', 'delete')",test-file | source-file
9905,awx,https://github.com/ansible/awx/issues/9905,Unable to cancel job - method POST not allowed - awx19,"<!-- Issues are for **concrete, actionable bugs and feature requests** only - if you're just asking for debugging help or technical support, please use: - http://webchat.freenode.net/?channels=ansible-awx - https://groups.google.com/forum/#!forum/awx-project We have to limit this because of limited volunteer time to respond to issues! -->  ISSUE TYPE - Bug Report  SUMMARY I had an inventory sync job that was stuck. Upon trying to cancel it, I got an error saying `Method ""POST"" not allowed` This is a refile of #9714 as the issue is still not fixed.  ENVIRONMENT * AWX version: 19.0.0 * AWX install method: minishift * Ansible version: * Operating System: Debian 10 * Web Browser: Chrome  STEPS TO REPRODUCE 1. Get a stuck job? 2. Try to cancel job.  EXPECTED RESULTS job to cancel  ACTUAL RESULTS  POST /api/v2/inventory_updates/11/cancel/ 405 Method ""POST"" not allowed.  ![image](https://user-images.githubusercontent.com/1826947/114759279-f7b63480-9d2b-11eb-96ff-2d5669e4c4a1.png)  ADDITIONAL INFORMATION <!-- Include any links to sosreport, database dumps, screenshots or other information. -->",source-file
7264,awx,https://github.com/ansible/awx/issues/7264,Mattermost Notification fails on latest release,"ISSUE TYPE - Bug Report  SUMMARY Trying to send a (test) notification to a Mattermost Channel fails with  mattermostinfo: Notification failed. Error sending notification mattermost: {""id"":""api.webhook.incoming.error"",""message"":""Could not decode the multipart payload of incoming webhook."",""detailed_error"":"""",""request_id"":""<request ID>"",""status_code"":400}   ENVIRONMENT * AWX version: 11.2.0 * AWX install method: docker on linux * Ansible version: 2.9.7 * Operating System: CentOS 7.8 * Web Browser: Chrome,Chromium,Firefox * Mattermost Server Version: 5.22.1  STEPS TO REPRODUCE - Create an incomming webhook - Create a mattermost notification - Send a test notification  EXPECTED RESULTS Having a notification in the Channel  ACTUAL RESULTS Sending failed with above error message  ADDITIONAL INFORMATION The error message in the mattermost log shows  {""level"":""error"",""ts"":1591342011.6592789,""caller"":""mlog/log.go:175"",""msg"":""Could not decode the multipart payload of incoming webhook."",""path"":""/ hooks/<hook ID>"",""request_id"":""<request ID>"",""ip_addr"":""<IP Address>"",""user_id"":"""",""method"":""POST"",""err_where"":"" incomingWebhook"",""http_code"":400,""err_details"":""mime: no media type""}   edit: some ID removed in the log sample, mattermost server version added",source-file | config-file | data-file | test-file | other-file | documentation-file
6128,awx,https://github.com/ansible/awx/issues/6128,AWX Collection user and role modules break when creating or updating an existing object,"ISSUE TYPE - Bug Report  SUMMARY  Collection Updating an object without a `name` field breaks, which also breaks idempotency. Probably because of: https://github.com/ansible/awx/blob/devel/awx_collection/plugins/module_utils/tower_api.py#L534  ENVIRONMENT * AWX version: 9.2.0 * AWX install method: docker on linux * Ansible version: 2.9.4 * Operating System: ubuntu 18.04  STEPS TO REPRODUCE Run a playbook that creates a user or role twice, the second time it will fail  EXPECTED RESULTS it should be Idempotent and know how to update those objects  ACTUAL RESULTS  PLAY [testhost]  TASK [Gathering Facts]  ok: [testhost] TASK [tower_user : Create a User]  fatal: [testhost]: FAILED! => {""changed"": false, ""msg"": ""Unable to process update of item due to missing data 'name'""} PLAY RECAP  testhost : ok=1 changed=0 unreachable=0 failed=1 skipped=0 rescued=0 ignored=0",source-file
9772,awx,https://github.com/ansible/awx/issues/9772,"Job output paginator can make requests to page 0 of job_events endpoint, resulting in unhandled 404","It's possible for the job output paginator to produce a request to page 0, which returns an unhandled 404: ![Screenshot from 2021-03-31 11-48-29](https://user-images.githubusercontent.com/9753817/113173073-0b837600-9217-11eb-9962-eccdd4e1785f.png)",test-file | source-file
10383,awx,https://github.com/ansible/awx/issues/10383,Unexpected api config requests on logout,"ISSUE TYPE - Bug Report  STEPS TO REPRODUCE - logout using the top-nav dropdown  EXPECTED RESULTS no requests are made to the config endpoint on logout  ACTUAL RESULTS requests are made to config endpoint, 400 errors",source-file
5110,awx,https://github.com/ansible/awx/issues/5110,"JOB TAGS and SKIP TAGS not being honored via ""prompt on launch""","ISSUE TYPE - Bug Report  SUMMARY User entered values for SKIP TAGS and JOB TAGS are not honored.  ENVIRONMENT * AWX version: 8.0.0 * AWX install method: docker on linux * Ansible version: 2.8.5 * Operating System: RHEL 7.6 * Web Browser: Chrome Version 78.0.3904.70 (Official Build) (64-bit)  STEPS TO REPRODUCE Configure a template to have null or populated values in JOB TAGS and SKIP TAGS and activate ""prompt on launch"" for those 2 fields. ![tags_null](https://user-images.githubusercontent.com/56000662/67570164-bb89b100-f6fe-11e9-8cd9-bc0b31d44edf.png) On launch, enter the tags one might want to run/skip ![tags_tagged](https://user-images.githubusercontent.com/56000662/67570267-eecc4000-f6fe-11e9-9671-c37445f0c425.png) Click next to get to the job preview. The preview shows no tags have been assigned to the job though they were in fact entered. On launch of the job, the requested tags will not be honored. ![tags_nothonored](https://user-images.githubusercontent.com/56000662/67570508-934e8200-f6ff-11e9-9d57-3af0801cd660.png) NOTE: If the template is saved WITH values, and prompt on launch is selected. You may REMOVE those predefined values with no issue. Any new values entered during ""prompt to launch"" will still go unrecognized.  EXPECTED RESULTS JOB TAGS and SKIP TAGS values are assigned via ""prompt on launch"" and honored in job execution ![tags_honored](https://user-images.githubusercontent.com/56000662/67570589-cbee5b80-f6ff-11e9-9eb9-d8f34d52e7df.png)  ACTUAL RESULTS Jobs run without honoring the tags entered by the user.  ADDITIONAL INFORMATION <!-- Include any links to sosreport, database dumps, screenshots or other information. -->",source-file
6492,awx,https://github.com/ansible/awx/issues/6492,ISSUE: Call to /api/v2/job_templates/12/launch failed. POST returned status: 504.,"<! The Ansible community is highly committed to the security of our open source projects. Security concerns should be reported directly by email to security@ansible.com. For more information on the Ansible community's practices regarding responsible disclosure, see https://www.ansible.com/security -->  ISSUE TYPE <! Pick one below and delete the rest: --> - Job Template Run - POST returned status: 504  COMPONENT NAME <!-- Pick the area of AWX for this issue, you can have multiple, delete the rest: --> - API  SUMMARY <!-- Briefly describe the problem. -->  ENVIRONMENT * AWX version: How to know the version? This is a newly installed AWX as well * AWX install method: docker on Linux * Ansible version: 2.9.6 * Operating System: CentOS 7 * Web Browser: Firefox  STEPS TO REPRODUCE The issue will be reproduced when Launching the Job Template <!-- For new features, show how the feature would be used. For bugs, please show exactly how to reproduce the problem. Ideally, provide all steps and data needed to recreate the bug from a new awx install. -->  EXPECTED RESULTS <!-- For bug reports, what did you expect to happen when running the steps above? -->  ACTUAL RESULTS - Call to /api/v2/job_templates/12/launch failed. POST returned status: 504. <!-- For bug reports, what actually happened? -->  ADDITIONAL INFORMATION <!-- Include any links to sosreport, database dumps, screenshots or other information. --> GUYS, PLEASE HELP ME WITH THIS ISSUE. :( Let me know if you need more info.",test-file | source-file
