issue_no,repo,issue_url,title,description,patched_file_types
4781,awx,https://github.com/ansible/awx/issues/4781,workflow_job_template_nodes POST authentication issuees,"ISSUE TYPE - Bug Report  SUMMARY When trying to POST to workflow_job_template_nodes using basic auth and/or token-auth AWX replies with 401 failure. `awx_web | 2019-09-19 08:40:32,754 WARNING awx.api.generics status 401 received by user AnonymousUser attempting to access /api/v2/workflow_job_template_nodes/ from XXX.XXX.XXX.XXX awx_web | 2019-09-19 08:40:32,780 WARNING django.request Bad Request: /api/v2/workflow_job_template_nodes/ awx_web | 2019-09-19 08:40:32,780 WARNING django.request Bad Request: /api/v2/workflow_job_template_nodes/ awx_web | [pid: 153|app: 0|req: 57/208] XXX.XXX.XXX.XXX () {38 vars in 568 bytes} [Thu Sep 19 08:40:32 2019] POST /api/v2/workflow_job_template_nodes/ => generated 140 bytes in 74 msecs (HTTP/1.1 400) 8 headers in 246 bytes (1 switches on core 0) awx_web | XXX.XXX.XXX.XXX - - [19/Sep/2019:08:40:32 +0000] ""POST /api/v2/workflow_job_template_nodes/ HTTP/1.1"" 400 140 ""-"" ""curl/7.54.0"" ""-""`  ENVIRONMENT * AWX version: 7.0.0 * AWX install method: docker on linux * Ansible version: 2.6 * Operating System: CentOS * Web Browser: Curl 7.54  STEPS TO REPRODUCE 0. nodes.json `{ { ""type"": ""workflow_job_template_node"", ""workflow_job_template"": { ""id"": 1238, ""name"": ""DNS WF"", ""description"": """" }, ""unified_job_template"": { ""id"": 820, ""name"": ""template-name"", ""unified_job_type"": ""job"" } ""extra_data"": {}, ""inventory"": null, ""scm_branch"": null, ""job_type"": null, ""job_tags"": """", ""skip_tags"": null, ""limit"": """", ""diff_mode"": null, ""verbosity"": null, ""workflow_job_template"": 1238, ""unified_job_template"": 820, ""success_nodes"": [], ""failure_nodes"": [], ""always_nodes"": [] } } ` 1. `curl -vvv -f -H 'Authorization: Token XXXX' -u username:password -H 'Content-Type: application/json' -XPOST http://awxhost/api/v2/workflow_job_template_nodes/ -d @nodes.json`  EXPECTED RESULTS Creation of nodes for related workflow  ACTUAL RESULTS Authorization failure. Client:  * The requested URL returned error: 400 Bad Request * stopped the pause stream! 100 706 0 0 100 706 0 7887 --:--:-- --:--:-- --:--:-- 7932 * Closing connection 0 curl: (22) The requested URL returned error: 400 Bad Request  Server: ``awx_web | 2019-09-19 08:40:32,754 WARNING awx.api.generics status 401 received by user AnonymousUser attempting to access /api/v2/workflow_job_template_nodes/ from XXX.XXX.XXX.XXX awx_web | 2019-09-19 08:40:32,780 WARNING django.request Bad Request: /api/v2/workflow_job_template_nodes/ awx_web | 2019-09-19 08:40:32,780 WARNING django.request Bad Request: /api/v2/workflow_job_template_nodes/ awx_web | [pid: 153|app: 0|req: 57/208] XXX.XXX.XXX.XXX () {38 vars in 568 bytes} [Thu Sep 19 08:40:32 2019] POST /api/v2/workflow_job_template_nodes/ => generated 140 bytes in 74 msecs (HTTP/1.1 400) 8 headers in 246 bytes (1 switches on core 0) awx_web | XXX.XXX.XXX.XXX - - [19/Sep/2019:08:40:32 +0000] ""POST /api/v2/workflow_job_template_nodes/ HTTP/1.1"" 400 140 ""-"" ""curl/7.54.0"" ""-""``  ADDITIONAL INFORMATION",source-file
8838,awx,https://github.com/ansible/awx/issues/8838,[ui_next] Inventory update Delete hits wrong endpoint,"ISSUE TYPE - Bug Report  SUMMARY Inventory update Delete hits wrong endpoint. I try to delete the SCM inventory update from the job page. It fails with an error about the inventory, but it shouldnt be deleting the inventory, it should only be deleting the update.  ENVIRONMENT * AWX version: 12/10  MORE INFO Also, thats not the right number for the inventory, 66 is the ID of the inventory update. ![Screen Shot 2020-12-10 at 3 52 00 PM](https://user-images.githubusercontent.com/12446869/101828548-b30d5900-3aff-11eb-8a7a-d10208387cbd.png)",test-file | source-file
4531,awx,https://github.com/ansible/awx/issues/4531,Unable to remove customized messages from notification template,"ISSUE TYPE - Bug Report  SUMMARY Unable to remove customized messages from notification template  STEPS TO REPRODUCE 1. Create a Slack notification with customized notification messages. 2. Edit Slack notification from step 1 and remove customized notification messages via toggle and save Note: 500 error  EXPECTED RESULTS 1. Default messages used and customize message toggle disabled  ACTUAL RESULTS HTTP 500 from API  ADDITIONAL INFORMATION <img width=""1497"" alt=""Screen Shot 2019-08-20 at 12 43 30 PM"" src=""https://user-images.githubusercontent.com/12446869/63366604-222dcf80-c348-11e9-80b7-a53a717a4b9f.png"">",source-file
5028,awx,https://github.com/ansible/awx/issues/5028,500 Error when creating notification templates with bad message format,"shell $ awx notification_templates create --name ""Testing 123"" --organization Default --notification_type webhook --messages '{""success"": ""500 error""}' --notification_configuration '{""url"": ""http://example.org"", ""headers"": {}}'  <img width=""932"" alt=""image"" src=""https://user-images.githubusercontent.com/214912/67009102-e2ba0000-f0b8-11e9-9346-816dea7ffa02.png"">",source-file
5744,awx,https://github.com/ansible/awx/issues/5744,More Helpful Error Message on api/v2/inventories Endpoint,"ISSUE TYPE - Bug Report  SUMMARY When trying to change a regular inventory into a ""smart"" inventory, the `PUT` and `PATCH` both error out (as they should), but the error message is not very informative. Please see screenshots below for both PUT and PATCH errors: <img width=""1048"" alt=""PUTNotAllowed"" src=""https://user-images.githubusercontent.com/28930622/72933561-f3b98380-3d2f-11ea-9269-7320367cabb3.png""> <img width=""1033"" alt=""PATCHNotAllowed"" src=""https://user-images.githubusercontent.com/28930622/72933566-f6b47400-3d2f-11ea-8540-147b2da53dc8.png""> It would be nice if the error was something more along the lines of `'You cannot turn a regular inventory into a ""smart"" inventory.'`  ENVIRONMENT * AWX version: 9.1.1 * AWX install method: docker for mac * Web Browser: Chrome  STEPS TO REPRODUCE Navigate to a pre-existing _regular_ inventory endpoint via `api/v2/inventories/[id]`, then try to `PUT` or `PATCH` to try to make it into a ""smart"" inventory:  { ""name"": ""[inventory_name]"", ""description"": """", ""organization"": [inventory_id], ""kind"": ""smart"", ""host_filter"": null, ""variables"": """", ""insights_credential"": null }   EXPECTED RESULTS An error message that tells the user that a regular inventory can't be turned into a smart inventory.  ACTUAL RESULTS  { ""detail"": ""Method \""PATCH\"" not allowed."" }",source-file | test-file | data-file | documentation-file
5478,awx,https://github.com/ansible/awx/issues/5478,Deleting Oauth token with itself throws 500 error,1. create an Oauth token for a user 2. delete the Oauth token using itself as the Bearer `curl -k -H 'Authorization: Bearer r8jwGD25D9rIDQ6F1lqcRwrejR9gR7' -X DELETE https://localhost/api/v2/tokens/21/` 3. Observe HTTP 500,source-file
6653,awx,https://github.com/ansible/awx/issues/6653,Machine credentials are refused by tower_job_template,"ISSUE TYPE - Bug Report  SUMMARY Can't create job template with tower_job_template because of credentials. Machine credentials (SSH) are refused.  ENVIRONMENT * AWX version: 10.0.0 * AWX install method: docker on linux * Ansible version: 2.9.5 * Operating System: Debian Buster * Web Browser: Firefox * AWX collection: 10.0.0  STEPS TO REPRODUCE  - name: Creation templates tower_job_template: name: ""{{ item.name }}"" playbook: ""{{ item.playbook }}"" inventory: ""{{ awx_inventory }}"" project: ""{{ awx_inventory }}"" credentials: - ""ssh-root-key"" survey_enabled: yes survey_spec: name: ""survey {{ item.name }}"" description: """" spec: ""{{ item.survey_spec }}"" tower_host: ""{{ tower_host }}"" tower_username: ""{{ tower_username }}"" tower_password: ""{{ tower_password }}"" validate_certs: False with_items: ""{{ awx_job_templates }}"" loop_control: label: ""{{ item.name }}"" tags: templates   EXPECTED RESULTS Template created  ACTUAL RESULTS  { ""ansible_loop_var"":""item"", ""changed"":false, ""item"":{ ""job_type"":""run"", ""name"":""Provisionning TWIN"", ""playbook"":""play-provisioning_twin.yml"", }, ""msg"":""Failed to add credential to job template: The Tower server claims it was sent a bad request.\n\nPOST https://localhost/api/v2/job_templates/9/extra_credentials/\nParams: None\nData: {\""id\"": 3, \""associate\"": true}\n\nResponse: {\""error\"":\""Extra credentials must be network or cloud.\""}"" }   ADDITIONAL INFORMATION `credential: ""ssh-root-key""` kinda works, but according to the documentation it is deprecated. And when I go into the web interface, the credentials field is empty.",test-file | source-file
6362,awx,https://github.com/ansible/awx/issues/6362,Can't Edit JT with no Inventory,"ISSUE TYPE - Bug Report  SUMMARY Can't Edit JT with no Inventory but Inventory Prompt on Launch  ENVIRONMENT * AWX version: 2.9 * AWX install method: docker for mac * Ansible version: 9.2 * Operating System: Mojave * Web Browser: Chrome  STEPS TO REPRODUCE Create a JT with no inventory, but click the Prompt On Launch checkbox. Go back and edit that inventory, but keep the inventory field empty and prompt on launch for it checked.  EXPECTED RESULTS The JT can be saved  ACTUAL RESULTS See that the JT can't be saved and returns a 400 error",test-file | source-file
12992,awx,https://github.com/ansible/awx/issues/12992,scm_url doesn't allow [IPV6]:portnum format,"Please confirm the following - [X] I agree to follow this project's [code of conduct](https://docs.ansible.com/ansible/latest/community/code_of_conduct.html). - [X] I have checked the [current issues](https://github.com/ansible/awx/issues) for duplicates. - [X] I understand that AWX is open source software provided for free and that I might not receive a timely response.  Bug Summary IPv6 addresses like `http://user:pass@[4444:5555:6666:7777:8888:11]:3000/sbf/foster.git` throws an error when attempting to sync a project with that scm_url `update_scm_url` is where the traceback is the issue is that we strip down the address and reform it, but when reforming we don't add the brackets back in. `netloc = u'@'.join(filter(None, [netloc, parts.hostname]))` parts.hostname does not include the brackets if the original url had brackets around the hostname, then we should re-add them back in  AWX version awx: 21.5.1.dev244+g5b5aac675b.d20221003  Select the relevant components - [ ] UI - [X] API - [ ] Docs - [ ] Collection - [ ] CLI - [ ] Other  Installation method docker development environment  Modifications no  Ansible version _No response_  Operating system _No response_  Web browser _No response_  Steps to reproduce create project with scm_url `http://user:pass@[4444:5555:6666:7777:8888:11]:3000/sbf/foster.git` attempt to launch a job  Expected results job runs  Actual results Traceback (most recent call last): File ""/awx_devel/awx/main/utils/common.py"", line 249, in update_scm_url if scm_type not in ('git', 'svn', 'insights', 'archive'): File ""/usr/lib64/python3.9/urllib/parse.py"", line 178, in port raise ValueError(message) from None ValueError: Port could not be cast to integer value as '5555:6666:7777:8888:11:3000' During handling of the above exception, another exception occurred: Traceback (most recent call last): File ""/awx_devel/awx/main/tasks/jobs.py"", line 512, in run self.build_extra_vars_file(self.instance, private_data_dir) File ""/awx_devel/awx/main/tasks/jobs.py"", line 1228, in build_extra_vars_file scm_url, extra_vars_new = self._build_scm_url_extra_vars(project_update) File ""/awx_devel/awx/main/tasks/jobs.py"", line 1203, in _build_scm_url_extra_vars scm_url = update_scm_url(scm_type, scm_url, scp_format=True) File ""/awx_devel/awx/main/utils/common.py"", line 249, in update_scm_url if scm_type not in ('git', 'svn', 'insights', 'archive'): ValueError: Invalid git URL  Additional information _No response_",test-file | source-file
4907,awx,https://github.com/ansible/awx/issues/4907,inventory updates + project updates deployed to container groups don't report execution node,"ISSUE TYPE - Bug Report  SUMMARY <!-- Briefly describe the problem. --> This is a known issue of https://github.com/ansible/awx/pull/4189 that will be resolved in follow up PR. Inventory updates need to run on a Tower node, and this does happen even when ""deployed"" to a Container Group. The problem is, there is no way to figure out from API what tower node it was deployed to. This is connected to the fact that there is no designated ""controller node"" for the Container Groups, solving that may help this. Regardless, currently if an inventory update is ""deployed"" to a container group it will show the container group on the inventory update, but no execution node or controller node, so it is unclear where the update actually ran.  STEPS TO REPRODUCE <!-- Please describe exactly how to reproduce the problem. --> 1) create a working Container Group 2) Create an organization 3) Assign Container Group to organization as only instance group 4) create inventory with inventory source OR create project 5) launch inventory update or project update  EXPECTED RESULTS <!-- What did you expect to happen when running the steps above? --> One of the Tower nodes is shown as execution node  ACTUAL RESULTS <!-- What actually happened? --> No execution node, only container group shown",source-file
10879,awx,https://github.com/ansible/awx/issues/10879,Errors caused by Social Auth Organization and Team Mapping; Users unable to login,"Please confirm the following - [X] I agree to follow this project's [code of conduct](http://docs.ansible.com/ansible/latest/community/code_of_conduct.html). - [X] I have checked the [current issues](https://github.com/ansible/awx/issues) for duplicates. - [X] I understand that AWX is open source software provided for free and that I am not entitled to status updates or other assurances.  Summary Attempting to configure Social Organization/Team Mapping prevents social-auth users from logging in. `awx-web` and postgres show errors. If ORGANIZATION_MAP and TEAM_MAP are reverted to default/empty, user is able to login.  AWX version 19.2.2  Installation method kubernetes  Modifications yes  Ansible version _No response_  Operating system _No response_  Web browser Chrome  Steps to reproduce 1. Fresh AWX 19.2.2 installation via awx-operator (0.12.0) with `create_preload_data: 'false'` 2. Log in as Admin; Configure Github Organization OAuth2 Social Auth ( do not configure org/team maps ) json { ""SOCIAL_AUTH_GITHUB_ORG_CALLBACK_URL"": ""https://my-awx-install.com/sso/complete/github-org/"", ""SOCIAL_AUTH_GITHUB_ORG_KEY"": ""<redacted>"", ""SOCIAL_AUTH_GITHUB_ORG_SECRET"": ""$encrypted$"", ""SOCIAL_AUTH_GITHUB_ORG_ORGANIZATION_MAP"": null, ""SOCIAL_AUTH_GITHUB_ORG_TEAM_MAP"": null }  3. Validate Step 2 configs by logging in via Github Org Social Auth 4. Log out. 5. Login as Admin; Configure Org/Team Maps (I tried this in both the Global and GitHub Org specific configs) json { ""SOCIAL_AUTH_GITHUB_ORG_CALLBACK_URL"": ""https://my-awx-install.com/sso/complete/github-org/"", ""SOCIAL_AUTH_GITHUB_ORG_KEY"": ""<redacted>"", ""SOCIAL_AUTH_GITHUB_ORG_SECRET"": ""$encrypted$"", ""SOCIAL_AUTH_GITHUB_ORG_NAME"": ""MyOrg"", ""SOCIAL_AUTH_GITHUB_ORG_ORGANIZATION_MAP"": { ""MyOrg"": { ""users"": [ ""me@example.com"" ], ""admins"": [ ""admin@example.com"" ], ""remove_users"": true, ""remove_admins"": true } }, ""SOCIAL_AUTH_GITHUB_ORG_TEAM_MAP"": { ""operations-team"": { ""remove"": true, ""organization"": ""MyOrg"", ""users"": [ ""me@example.com"" ] } } }  6. Attempt to login as user; Get redirected to login page; Observe error awx-web and postgres error logs  Expected results Organizations specified by valid Social Auth Org map(s) are created automatically Teams specified by valid Social Auth Team map(s) are created automatically Users are able to login as specified by Social Auth Org/Team maps  Actual results User was not able to login following Org/Map configuration. Organization and Teams were not created on our behalf. `postgres` errors bash 2021-08-13 21:39:42.438 UTC [2886] STATEMENT: INSERT INTO ""main_organizationgalaxycredentialmembership"" (""organization_id"", ""credential_id"", ""position"") VALUES (1, NULL, NULL) RETURNING ""main_organizationgalaxycredentialmembership"".""id"" 2021-08-13 21:39:42.438 UTC [2886] ERROR: null value in column ""credential_id"" violates not-null constraint 2021-08-13 21:39:42.438 UTC [2886] DETAIL: Failing row contains (1, null, null, 1).  `awx-web` errors  2021-08-13 21:39:42,440 ERROR [c6496ec03db747d3a7800f653acd316b] social null value in column ""credential_id"" violates not-null constraint DETAIL: Failing row contains (1, null, null, 1). .   Additional information * Installed via awx-operator with `create_preload_data: false` * Prior to opening this issue, I've also attempted this against 19.3.0 to no success.",source-file
10008,awx,https://github.com/ansible/awx/issues/10008,awx.awx.tower_job_launch tags are not properly passed to API,"ISSUE TYPE - Bug Report  SUMMARY If you are using awx.awx.tower_job_launch to launch a job-/workflowtemplate in AWX and you pass tags to the job launch they will be ignored. Against expectations all tasks are executed not only those with the provided tags  ENVIRONMENT * AWX version: Tower 3.8.2 * Ansible version: Ansible 2.9.13 * Operating System: RHEL 8.3  STEPS TO REPRODUCE Create a playbook similar to this:  - hosts: localhost gather_facts: no environment: TOWER_USERNAME: ""<<INPUT TOWER USERNAME HERE>>"" TOWER_HOST: ""<<INPUT TOWER HOST HERE>>"" TOWER_PASSWORD: ""<<INPUT TOWER USER PASSWORD HERE>>"" vars: ansible_connection: local tasks: - name: Launch a job template with a tag on remote Tower instance awx.awx.tower_job_launch: job_template: ""test_template"" inventory: ""test_inventory"" tags: - example_tag  Create a second playbook named ""test_template"" with two random tasks. One needs to be tagged with ""example_tag""  EXPECTED RESULTS Only the task tagged with ""example_tag"" will be executed  ACTUAL RESULTS All tasks will be executed  ADDITIONAL INFORMATION The error occurs because [tower_job_launch.py](https://github.com/ansible/awx/blob/devel/awx_collection/plugins/modules/tower_job_launch.py) passes the wrong post data to the api. The tags have to be provided under key ""job_tags"". This can be found in [API documentation](https://docs.ansible.com/ansible-tower/latest/html/towerapi/api_ref.html#/Job_Templates/Job_Templates_job_templates_launch_read). Certainly the module passes the tags with the key ""tags"" which is wrong I think the follwing code needs to be adjusted: https://github.com/ansible/awx/blob/devel/awx_collection/plugins/modules/tower_job_launch.py#L184 The correct line should be: ` optional_args['job_tags'] = module.params.get('tags')` I will test the suggestion on monday and report the result.",test-file | source-file
6520,awx,https://github.com/ansible/awx/issues/6520,Logout button on the API for ui-next does not work,"ISSUE TYPE - Bug Report  SUMMARY Click on the logout button on the API for ui-next makes a get request instead of a post request, due to which an error is thrown  STEPS TO REPRODUCE 1. https://localhost:3000/api 2. click on the logout button <img width=""352"" alt=""Screen Shot 2020-04-01 at 10 28 17 AM"" src=""https://user-images.githubusercontent.com/11617351/78149937-98c59c00-7404-11ea-9a9d-f954d1e9e24f.png"">  EXPECTED RESULTS The logout should be successfull  ACTUAL RESULTS An error is thrown: <img width=""533"" alt=""Screen Shot 2020-04-01 at 10 28 34 AM"" src=""https://user-images.githubusercontent.com/11617351/78149948-9c592300-7404-11ea-8be8-cb87c67542cf.png"">",test-file
6225,awx,https://github.com/ansible/awx/issues/6225,ask_variables_on_launch issue on AWX,"ISSUE TYPE ask_variables_on_launch is set to true still getting error as undefined variable.  SUMMARY I have created a Job template via API and set the ask_variables_on_launch value to true. Though setting the value as true, playbook fails during execution, saying 'undefined variable'  ENVIRONMENT * AWX version: 9.2.0 * Tower CLI 3.3.8 * API v2 * AWX install method: Installation without Docker on CentOS7 * Ansible version: 2.9.5 * Operating System: CentOS Linux release 7.7.1908 (Core) * Web Browser: Google Chrome Version 80.0.3987.132 (Official Build) (64-bit)  STEPS TO REPRODUCE >> Created a Job Template for sample. >> Verify the values of the sample job template for 'project, inventory, playbook' attributes, and its corresponding values. >> With the values observed from the sample job template, create a new job template via APIv2 and set the value of ""ask_variables_on_launch to true"" * API URL: * http://awx-server-ip/api/v2/job_templates/  EXPECTED RESULTS Being set the value of 'ask_variables_on_launch' to true, I should be able to execute the playbook by passing extra variable during launch of the playbook and via Survey as well.  ACTUAL RESULTS ""msg"": ""The task includes an option with an undefined variable. The error was: 'ansible.utils.unsafe_proxy.AnsibleUnsafeText object' has no attribute 'it_user'\n\nThe error appears to be in '/tmp/awx_25_ahs6_izp/project/useradd_IT.yml': line 7, column 7, but may\nbe elsewhere in the file depending on the exact syntax problem.\n\nThe offending line appears to be:\n\n tasks:\n - name: Adding users\n ^ here\n"", ""_ansible_no_log"": false --The same error occurred when the value of 'ask_variables_on_launch' set as false.  ADDITIONAL INFORMATION ![image](https://user-images.githubusercontent.com/47471901/76210019-3d4f2680-6229-11ea-95f8-04dc9ac4f84d.png) ![image](https://user-images.githubusercontent.com/47471901/76210151-87380c80-6229-11ea-8e8e-2359422c1276.png)",source-file
5964,awx,https://github.com/ansible/awx/issues/5964,awx kit provides a bad error message,"ISSUE TYPE - Bug Report  SUMMARY When authentication fails awx kit gives a cryptic error message  ENVIRONMENT * AWX version: devel * AWX install method: mac * Ansible version: 2.8.2 * Operating System: mac * Web Browser: N/A  STEPS TO REPRODUCE Attempt to login to awx with bad credentials.  EXPECTED RESULTS > Unauthorized: Unauthorized (401) received - {'detail': 'Authentication credentials were not provided. To establish a login session, visit /api/login/.'}  ACTUAL RESULTS > TypeError: '>=' not supported between instances of 'Unauthorized' and 'int'  ADDITIONAL INFORMATION > akit --base-url httsp://some-awx -c ~/creds/credentials.vault -f load_resources.py -x",source-file
6433,awx,https://github.com/ansible/awx/issues/6433,Can't save the modal when adding a team role to an organization,"ISSUE TYPE - Bug Report  SUMMARY The save button in this screenshot doesn't always work: ![Screenshot from 2020-03-26 09-39-57](https://user-images.githubusercontent.com/19942822/77653157-c9f62600-6f45-11ea-87d1-8c2ad40e1d12.png)  STEPS TO REPRODUCE 1. Make a team and org, put the team inside the org. 2. Go to org -> Access tab -> add a team permission 3. Try to give the team admin permissions.  EXPECTED RESULTS Clicking the save button works, or presents an error.  ACTUAL RESULTS No visual feedback, the button appears to not respond. The network tab presents a 400: {""msg"":""You cannot assign an Organization participation role as a child role for a Team.""}",config-file
