issue_no,repo,issue_url,title,description,patched_file_types
7314,nopCommerce,https://github.com/nopSolutions/nopCommerce/issues/7314,"RePostPayment fails with System.InvalidOperationException: Headers are read-only, response has already started.","nopCommerce version: 4.6+ Steps to reproduce the problem: Calling RePostPayment fails with ""System.InvalidOperationException: Headers are read-only, response has already started."" at Microsoft.AspNetCore.Server.Kestrel.Core.Internal.Http.HttpHeaders.ThrowHeadersReadOnlyException() at Microsoft.AspNetCore.Server.Kestrel.Core.Internal.Http.HttpResponseHeaders.Microsoft.AspNetCore.Http.IHeaderDictionary.set_ContentType(StringValues value) at Microsoft.AspNetCore.Http.DefaultHttpResponse.set_ContentType(String value) at Microsoft.AspNetCore.Mvc.Infrastructure.ContentResultExecutor.ExecuteAsync(ActionContext context, ContentResult result) at Microsoft.AspNetCore.Mvc.Infrastructure.ResourceInvoker.<InvokeNextResultFilterAsync>g__Awaited|30_0[TFilter,TFilterAsync](ResourceInvoker invoker, Task lastTask, State next, Scope scope, Object state, Boolean isCompleted) at Microsoft.AspNetCore.Mvc.Infrastructure.ResourceInvoker.Rethrow(ResultExecutedContextSealed context) at Microsoft.AspNetCore.Mvc.Infrastructure.ResourceInvoker.ResultNext[TFilter,TFilterAsync](State& next, Scope& scope, Object& state, Boolean& isCompleted) at Microsoft.AspNetCore.Mvc.Infrastructure.ResourceInvoker.InvokeResultFilters()  End of stack trace from previous location  https://github.com/nopSolutions/nopCommerce/blob/020f7571c2f37beedc33c8bfb04ab53565623c1b/src/Presentation/Nop.Web/Controllers/OrderController.cs#L237 Will write the form to the body. https://github.com/nopSolutions/nopCommerce/blob/020f7571c2f37beedc33c8bfb04ab53565623c1b/src/Presentation/Nop.Web/Controllers/OrderController.cs#L242 Will try to set Content Type header because of Content(""Redirected"").  Consider ""return new EmptyResult()"" instead of ""Content(""Redirected"")"", along with adding a <noscript> wrapped text ""please enable javascript"" or similar, to RemotePost https://github.com/nopSolutions/nopCommerce/blob/020f7571c2f37beedc33c8bfb04ab53565623c1b/src/Presentation/Nop.Web.Framework/RemotePost.cs#L115",source-file
2776,nopCommerce,https://github.com/nopSolutions/nopCommerce/issues/2776,/customer/productreviews doesn't respect Product's LimitToStores setting,"How to reproduce - 1. Setup two stores 2. Create a product and limit it to Store 1 3. Write a review for the product 4. Go to /customer/productreviews at Store 2 5. The review will be visible, even though it cannot be loaded",data-file | database-file | source-file | other-file | documentation-file | config-file
7308,nopCommerce,https://github.com/nopSolutions/nopCommerce/issues/7308,AJAX catalog requests should be converted from GET to POST,**nopCommerce version: 4.70.4** URL from Google results redirects to page without CSS In continuation of https://github.com/nopSolutions/nopCommerce/issues/7286. We should not allow to directly access them with GET (convert them to POST if possible),source-file | test-file
5359,nopCommerce,https://github.com/nopSolutions/nopCommerce/issues/5359,Country State Ajax loader is not stopped,nopCommerce version: 4.40 Beta Steps to reproduce the problem: 1) Register new customer 2) Add any product to cart 3) Do checkout while filling the billing address click on country dropdown and select country ajax loader is continues loading. If state is filling based on country than also it is loading continuously. ![image](https://user-images.githubusercontent.com/41533502/108676031-9cc34680-750d-11eb-93b4-02288076bf31.png),source-file
183,nopCommerce,https://github.com/nopSolutions/nopCommerce/issues/183,"General error fix for the ""Error during serialization"" issues (admin area only)","When we have too long json return we can get an exception - http://www.nopcommerce.com/boards/t/38582/blog-posts-not-appearing-in-admin-screen.aspx However, adding this override on BaseController will fix the issue in cases we need the content to be on the first place:  protected override JsonResult Json(object data, string contentType, Encoding contentEncoding, JsonRequestBehavior behavior) { return new JsonResult() { Data = data, ContentType = contentType, ContentEncoding = contentEncoding, JsonRequestBehavior = behavior, MaxJsonLength = Int32.MaxValue }; }  Source: http://www.nopcommerce.com/boards/t/38582/blog-posts-not-appearing-in-admin-screen.aspx?p=2",source-file
3946,nopCommerce,https://github.com/nopSolutions/nopCommerce/issues/3946,"Registration activation with ""+"" in the email addres will not be successfull","nopCommerce version: 4.20 Steps to reproduce the problem: If the activation link contains the email in an unescaped format like this (user+name@gmail.com) then the plus sign in the URL is represents a space, so the activation will not be successful for the email ""user name@gmail.com"". Source: Premium Support #14907",source-file | ui-file
3630,nopCommerce,https://github.com/nopSolutions/nopCommerce/issues/3630,"Return 404 page when a topic, blog post, news item cannot be loaded",Right now it redirects to the home page,source-file
7101,nopCommerce,https://github.com/nopSolutions/nopCommerce/issues/7101,Add more checks when validate shopping cart item attributes,"nopCommerce version: 4.60 > 1. Create a new nop installation, including the demo data (no plugins, no themes). > 2. Go to ""Nike Tailwind Loose Short-Sleeve Running Shirt"" in the frontend > 3. Select size ""Small"" > 4. Add the product to the cart, and place the order. > 5. Open exactly the same product in the backend > 6. Delete the product attribute value ""small"" from within the backend > 7. Navigate to the frontend, ""My Account > Orders"" and select the last order > 8. Press ""Rebuy"" and wait for redirect into the shopping cart > > And here is the problem. Once you are in the shopping cart you can see that there is already something weird happing. There is no product attribute description displayed. If you have a look at the database, your shopping cart item still contains the old product attribute Id that you previously deleted. > > 9. Place the order > > You were now successfully able to purchase a product (product attribute value) that no longer exists. Source: https://www.nopcommerce.com/boards/topic/98780/inconsistent-product-attribute-handling-in-reorder-functionality",source-file
3139,nopCommerce,https://github.com/nopSolutions/nopCommerce/issues/3139,Error when using a URL (store) that does not exist. It should throw error with usable errormessage.,"nopCommerce version: 4.1 Steps to reproduce the problem: If you have a url in the store(settings) that does not exist, you get a 502 error with no real error message. In order to find the real error, you have to debug the solution and get ""No such host"". Should there be a seperate URL for development?",source-file
3584,nopCommerce,https://github.com/nopSolutions/nopCommerce/issues/3584,Customer is Null when updating Return Request,"When i try to update the status of a return request the customer information is not populated at all, and so a null reference is thrown. Source: https://www.nopcommerce.com/boards/t/58325/customer-is-null-when-updating-return-request-local-environment-sqlexpress.aspx",config-file
6444,nopCommerce,https://github.com/nopSolutions/nopCommerce/issues/6444,Search by ipaddress on customer search page list not working properly,nopCommerce version: 460beta Steps to reproduce the problem: Search by ipaddress on customer search page list not working properly domain/Admin/Customer/List Search in ip address with space and without space before number 172.70.218.52,source-file
5746,nopCommerce,https://github.com/nopSolutions/nopCommerce/issues/5746,Sequence contains no elements,"nopCommerce version: 4.40.x Steps to reproduce the problem: We're getting a lot of 'Sequence contains no elements' errors in the logs, relating to '/catalog/getcatalogsubcategories' - we're using the ajax main menu. `System.InvalidOperationException: Sequence contains no elements at System.Linq.ThrowHelper.ThrowNoElementsException() at System.Linq.Enumerable.First[TSource](IEnumerable`1 source) at Nop.Web.Factories.CatalogModelFactory.PrepareSubCategoriesAsync(Int32 id) at Nop.Web.Controllers.CatalogController.GetCatalogSubCategories(Int32 id) at Microsoft.AspNetCore.Mvc.Infrastructure.ActionMethodExecutor.TaskOfIActionResultExecutor.Execute(IActionResultTypeMapper mapper, ObjectMethodExecutor executor, Object controller, Object[] arguments) at Microsoft.AspNetCore.Mvc.Infrastructure.ControllerActionInvoker.<InvokeActionMethodAsync>g__Awaited|12_0(ControllerActionInvoker invoker, ValueTask`1 actionResultValueTask) at Microsoft.AspNetCore.Mvc.Infrastructure.ControllerActionInvoker.<InvokeNextActionFilterAsync>g__Awaited|10_0(ControllerActionInvoker invoker, Task lastTask, State next, Scope scope, Object state, Boolean isCompleted) at Microsoft.AspNetCore.Mvc.Infrastructure.ControllerActionInvoker.Rethrow(ActionExecutedContextSealed context) at Microsoft.AspNetCore.Mvc.Infrastructure.ControllerActionInvoker.Next(State& next, Scope& scope, Object& state, Boolean& isCompleted) at Microsoft.AspNetCore.Mvc.Infrastructure.ControllerActionInvoker.InvokeInnerFilterAsync()  End of stack trace from previous location  at Microsoft.AspNetCore.Mvc.Infrastructure.ResourceInvoker.<InvokeNextResourceFilter>g__Awaited|24_0(ResourceInvoker invoker, Task lastTask, State next, Scope scope, Object state, Boolean isCompleted) at Microsoft.AspNetCore.Mvc.Infrastructure.ResourceInvoker.Rethrow(ResourceExecutedContextSealed context) at Microsoft.AspNetCore.Mvc.Infrastructure.ResourceInvoker.Next(State& next, Scope& scope, Object& state, Boolean& isCompleted) at Microsoft.AspNetCore.Mvc.Infrastructure.ResourceInvoker.InvokeFilterPipelineAsync()  End of stack trace from previous location  at Microsoft.AspNetCore.Mvc.Infrastructure.ResourceInvoker.<InvokeAsync>g__Logged|17_1(ResourceInvoker invoker) at Microsoft.AspNetCore.Routing.EndpointMiddleware.<Invoke>g__AwaitRequestTask|6_0(Endpoint endpoint, Task requestTask, ILogger logger) at WebMarkupMin.AspNetCore5.WebMarkupMinMiddlewareBase.Invoke(HttpContext context) at StackExchange.Profiling.MiniProfilerMiddleware.Invoke(HttpContext context) in C:\projects\dotnet\src\MiniProfiler.AspNetCore\MiniProfilerMiddleware.cs:line 125 at Microsoft.AspNetCore.Authorization.AuthorizationMiddleware.Invoke(HttpContext context) at Nop.Services.Authentication.AuthenticationMiddleware.InvokeAsync(HttpContext context) at FoxNetSoft.Plugin.Misc.CDNConnector.Infrastructure.CDNConnectorMiddleware.Invoke(HttpContext context) at Microsoft.AspNetCore.Localization.RequestLocalizationMiddleware.Invoke(HttpContext context) at Microsoft.AspNetCore.Session.SessionMiddleware.Invoke(HttpContext context) at Microsoft.AspNetCore.Session.SessionMiddleware.Invoke(HttpContext context) at Nop.Services.Installation.InstallUrlMiddleware.InvokeAsync(HttpContext context, IWebHelper webHelper) at Nop.Services.Common.KeepAliveMiddleware.InvokeAsync(HttpContext context, IWebHelper webHelper) at Microsoft.AspNetCore.ResponseCompression.ResponseCompressionMiddleware.Invoke(HttpContext context) at Microsoft.AspNetCore.Diagnostics.StatusCodePagesMiddleware.Invoke(HttpContext context) at Microsoft.AspNetCore.Diagnostics.StatusCodePagesMiddleware.Invoke(HttpContext context) at Microsoft.AspNetCore.Diagnostics.ExceptionHandlerMiddleware.<Invoke>g__Awaited|6_0(ExceptionHandlerMiddleware middleware, HttpContext context, Task task)` ![Screen Shot 2021-06-25 at 13 32 29](https://user-images.githubusercontent.com/12123259/123425273-d8544700-d5b9-11eb-8411-b58fe9038743.png)",source-file
5400,nopCommerce,https://github.com/nopSolutions/nopCommerce/issues/5400,Adding a new forum display wrong error message / Admin side,nopCommerce version: 4.40 Beta Steps to reproduce the problem: 1. Admin > Forum -> CreateForum 2. Click on Save or save and Continue Edit 3. display wrong error message of forum https://prnt.sc/104oq24,source-file | data-file
4621,nopCommerce,https://github.com/nopSolutions/nopCommerce/issues/4621,GetAllCheckoutAttributes returns incorrect list of store-specific attributes,"nopCommerce version: 4.20 For example, if we have this setup: Stores: * Store1 (ID: **1**) * Store2 (ID: **2**) Checkout attributes: * Attribute1 (All stores - not limited) * Attribute2 (Limited to Store2) Calling `GetAllCheckoutAttributes(2)` while in the admin area of Store1, will only return Attribute1. Given that I'm passing in the store id of Store2, shouldn't that have returned both Attribute1 and Attribute2? Shouldn't this authorization check `_storeMappingService.Authorize(ca)` be passing in the `storeId` parameter instead? (i.e. `_storeMappingService.Authorize(ca, storeId)`). At the moment, the `storeId` parameter is not used anywhere to actually limit the list to that store. More info: https://github.com/nopSolutions/nopCommerce/blob/develop/src/Libraries/Nop.Services/Orders/CheckoutAttributeService.cs#L103",source-file
5553,nopCommerce,https://github.com/nopSolutions/nopCommerce/issues/5553,VisibleIndividually option ignored,"nopCommerce version: 4.40 Steps to reproduce the problem: - Set a product in the catalog so 'Visible individually' option is not selected. - Start the store where this product is available - In the search box or in the item by category list, the product appears when it should not Fix: - In Nop.Services\Catalog\ProductServices.cs, - In public virtual async Task<IPagedList<Product>> SearchProductsAsync - Check the value (after line 815) with the below code `if (visibleIndividuallyOnly) productsQuery = productsQuery.Where(p => p.VisibleIndividually);`",source-file
3174,nopCommerce,https://github.com/nopSolutions/nopCommerce/issues/3174,"Entity (Product, category, manufacturer, etc) seo name isn't changed based on language selection","nopCommerce version: beta 4.10 Steps to reproduce the problem: I added one language German. After i edited Apple-Icam product name and seo name in German language product name = to ICAM(German tab) Seo name = v-scla-hiu-new-york Front side when i opened product detail for English and German language . Working fine for both but **url seo** name is not changed based on language. Also,i enabled seo friendly url.",source-file
6610,nopCommerce,https://github.com/nopSolutions/nopCommerce/issues/6610,"In My Account-Addresses section, address gets saved when 'country'(required field) is kept empty.","nopCommerce version: 4.60.2 Steps to reproduce the problem: 1. Open My Account-Addresses menu. 2. Click on ""ADD NEW"" button. 3. Enter data in all fields except in ""Country"" field(do not select any country). 4. Click on ""SAVE"" button. 5. Check that the address gets saved successfully. ![MicrosoftTeams-image](https://user-images.githubusercontent.com/121164051/220570342-95fa71ef-e5ba-4359-a75c-438d3a68328f.png)",source-file
3411,nopCommerce,https://github.com/nopSolutions/nopCommerce/issues/3411,Form value count limit 2048 exceeded.,"nopCommerce version: 4.1 Steps to reproduce the problem: We have around 25 methods in Admin/Shipping/Restrictions multiplied for around 250 countries we get around 6250 elements in the form, far more than 2048 limit. Full error here: > System.IO.InvalidDataException: Form value count limit 2048 exceeded. > at Microsoft.AspNetCore.WebUtilities.FormReader.Append(KeyValueAccumulator& accumulator) > at Microsoft.AspNetCore.WebUtilities.FormReader.ReadFormAsync(CancellationToken cancellationToken) > at Microsoft.AspNetCore.Http.Features.FormFeature.InnerReadFormAsync(CancellationToken cancellationToken) > at Microsoft.AspNetCore.Mvc.ModelBinding.FormValueProviderFactory.AddValueProviderAsync(ValueProviderFactoryContext context) > at Microsoft.AspNetCore.Mvc.ModelBinding.CompositeValueProvider.CreateAsync(ActionContext actionContext, IList`1 factories) > at Microsoft.AspNetCore.Mvc.ModelBinding.CompositeValueProvider.CreateAsync(ControllerContext controllerContext) > at Microsoft.AspNetCore.Mvc.Internal.ControllerBinderDelegateProvider.<>c__DisplayClass0_0.<<CreateBinderDelegate>g__Bind|0>d.MoveNext() >  End of stack trace from previous location where exception was thrown  > at Microsoft.AspNetCore.Mvc.Internal.ControllerActionInvoker.InvokeInnerFilterAsync() > at Microsoft.AspNetCore.Mvc.Internal.ResourceInvoker.InvokeNextResourceFilter() > at Microsoft.AspNetCore.Mvc.Internal.ResourceInvoker.Rethrow(ResourceExecutedContext context) > at Microsoft.AspNetCore.Mvc.Internal.ResourceInvoker.Next(State& next, Scope& scope, Object& state, Boolean& isCompleted) > at Microsoft.AspNetCore.Mvc.Internal.ResourceInvoker.InvokeFilterPipelineAsync() > at Microsoft.AspNetCore.Mvc.Internal.ResourceInvoker.InvokeAsync() > at Microsoft.AspNetCore.Builder.RouterMiddleware.Invoke(HttpContext httpContext) > at StackExchange.Profiling.MiniProfilerMiddleware.Invoke(HttpContext context) in C:\projects\dotnet\src\MiniProfiler.AspNetCore\MiniProfilerMiddleware.cs:line 94 > at Nop.Services.Authentication.AuthenticationMiddleware.Invoke(HttpContext context) in C:\andrei\nopcommerce\sources\src\Libraries\Nop.Services\Authentication\AuthenticationMiddleware.cs:line 79 > at Microsoft.AspNetCore.Localization.RequestLocalizationMiddleware.Invoke(HttpContext context) > at Microsoft.AspNetCore.Session.SessionMiddleware.Invoke(HttpContext context) > at Microsoft.AspNetCore.Session.SessionMiddleware.Invoke(HttpContext context) > at Nop.Core.Http.InstallUrlMiddleware.Invoke(HttpContext context, IWebHelper webHelper) in C:\andrei\nopcommerce\sources\src\Libraries\Nop.Core\Http\InstallUrlMiddleware.cs:line 51 > at Nop.Core.Http.KeepAliveMiddleware.Invoke(HttpContext context, IWebHelper webHelper) in C:\andrei\nopcommerce\sources\src\Libraries\Nop.Core\Http\KeepAliveMiddleware.cs:line 50 > at Microsoft.AspNetCore.StaticFiles.StaticFileMiddleware.Invoke(HttpContext context) > at Microsoft.AspNetCore.StaticFiles.StaticFileMiddleware.Invoke(HttpContext context) > at Microsoft.AspNetCore.StaticFiles.StaticFileMiddleware.Invoke(HttpContext context) > at Microsoft.AspNetCore.StaticFiles.StaticFileMiddleware.Invoke(HttpContext context) > at Microsoft.AspNetCore.Diagnostics.StatusCodePagesMiddleware.Invoke(HttpContext context) > at Microsoft.AspNetCore.Diagnostics.StatusCodePagesMiddleware.Invoke(HttpContext context) > at Microsoft.AspNetCore.Diagnostics.ExceptionHandlerMiddleware.Invoke(HttpContext context) >",source-file
5990,nopCommerce,https://github.com/nopSolutions/nopCommerce/issues/5990,"Estimate shipping not applying on the shopping cart page when enabled setting ""Use a city name for estimate shipping""","nopCommerce version: 4.50 Steps to reproduce the problem: Turn on the ""Use city name to estimate shipping"" option and try calculating shipping on the shopping cart page. You will receive a validation error for the ZipPostalCode field, which should not be validated in this case.",source-file
2532,nopCommerce,https://github.com/nopSolutions/nopCommerce/issues/2532,"Make ""Country"" required in the Estimate shipping form",It has a required asterisk but you still can leave this field empty,database-file | source-file | data-file
5198,nopCommerce,https://github.com/nopSolutions/nopCommerce/issues/5198,Don't throw an exception on incorrect model binding from URL params,"nopCommerce version: develop An exception may throw for example due to a type mismatch, when a model property is bool and the value comes in int. In this case the binding should just ignore the value and not throw an exception.",source-file
7490,nopCommerce,https://github.com/nopSolutions/nopCommerce/issues/7490,Error messages aren't showing on uploading pictures for product,nopCommerce version: 4.80 Steps to reproduce the problem: Json-responses containing an error message aren't displayed on client side when picture uploading fails,ui-file
3751,nopCommerce,https://github.com/nopSolutions/nopCommerce/issues/3751,Redis serialization self-referencing loop for SpecificationAttributes,"nopCommerce version: 4.20 beta Steps to reproduce the problem: 1. Enable Redis caching 2. In admin panel, edit a product with specification attributes An internal server error occurs: `JsonSerializationException: Self referencing loop detected for property 'SpecificationAttribute' with type 'Castle.Proxies.SpecificationAttributeProxy'. Path '[0].SpecificationAttributeOptions[0]'.` The Models for `SpecificationAttribute` and `SpecificationAttributeOption` refer to each other so when they get serialized it's causing this circular reference error. Locally I added a `[JsonIgnore]` attribute to the `SpecificationAttributeOption`'s `SpecificationAttribute` property, which seems to fix the issue.",source-file
6859,nopCommerce,https://github.com/nopSolutions/nopCommerce/issues/6859,MultiPage-Checkout: edit address redirects to 404 when state not selected,"nopCommerce version: 4.60.1+ (unable to reproduce in 4.60.0) Steps to reproduce the problem: 1. Make sure the following prerequisites are in place a) One page checkout is disabled b) State / province setting for Addresses enabled 2. Put an item in your cart and start an checkout. Proceed to the billing address page 3. Make sure you have an address that you can edit (if not, create a new one first and place an order with it, so that the address gets properly saved) 4. Edit an address 5. Select a country with states, but do not touch the state. If there is already a state set, please select ""Select state"" 6. Click ""Next"" You will be redirect to the 404 page not found page. Expected behavior: Show an error message, indicating that a state needs to be selected.",source-file
6403,nopCommerce,https://github.com/nopSolutions/nopCommerce/issues/6403,Add missed vendor access check to orders,nopCommerce version: 4.50.4 Steps to reproduce the problem: The /Admin/Orders/PdfInvoice does not sufficiently check if a vendor should have access to an invoice https://github.com/nopSolutions/nopCommerce/blob/23e3edf92ccaa4887d2aa8e4b5939eb97d1a1efa/src/Presentation/Nop.Web/Areas/Admin/Controllers/OrderController.cs#L906,source-file
4432,nopCommerce,https://github.com/nopSolutions/nopCommerce/issues/4432,Cart page - No warning message displaying on apply discount coupon or gift card message,nopCommerce version: 4.30 Beta Steps to reproduce the problem: Add few products to cart Then apply wrong coupon code or gift card code. It should display proper message but it nothing display. Current demo store(4.20) is display proper message. See this video - https://www.loom.com/share/5a87e2d190244363bc7f84bcaf5d2fac,source-file
3604,nopCommerce,https://github.com/nopSolutions/nopCommerce/issues/3604,Non-developer internal server error page not returning 500,"nopCommerce version: 4.1 Steps to reproduce the problem: Add a code or data change that causes an internal server error (e.g. adding a divide by zero to a controller's action) Run nop, making sure that the developer exception page is not enabled (see ApplicationBuilderExtensions's UseNopExceptionHandler) Navigate to the page that causes that error The response code will be something other than 500.",source-file
6723,nopCommerce,https://github.com/nopSolutions/nopCommerce/issues/6723,400 bad request when trying to cancel/edit large order,"nopCommerce version: 4.60.3 Steps to reproduce the problem: The order that I'm working with has 432 items. When i try to cancel the order with the `cancel` button, or perform a manual status change, the change fails and the user receives a blank page. Dev tools and nop log show 400 bad request. Since the edit page is one big form that posts all input values regardless of what action is being taken on the order, and each order item has 6 attributes being posted, this results in 2,592 form fields being posted + approximately 25 other fields. So, the edit form for this order is submitting over 2,600 fields. This exceeds the default value of 1024 for the `RequestFormLimits` action attribute. I ran into a similar problem when developing a plugin for wholesale ordering. The best fix, in my opinion would involve limiting the form fields to only submit the values to what is necessary for what is being changed. The quick, less secure/robust fix would be adding `[DisableRequestSizeLimit]`, `[RequestFormLimits(ValueCountLimit = int.MaxValue, KeyLengthLimit = int.MaxValue)]` attributes to the `CancelOrder` action and other edit related actions which could suffer from this same issue. I can certainly apply the attribute overrides to my local build to get it working, but I would like to see a more robust upstream fix for this.",source-file | ui-file
5469,nopCommerce,https://github.com/nopSolutions/nopCommerce/issues/5469,Required field condition is not checked at Shipping origin tab,nopCommerce version : 4.40 beta Steps to reproduce the problem: 1) /Admin/Setting/Shipping 2) GO Shipping origin 3) Some of the field screen shot attached here Required field condition is not checked. **It will save with blank value.** ![image](https://user-images.githubusercontent.com/41533502/109268087-98aa6800-7830-11eb-84e3-4d12361556c7.png),source-file
7212,nopCommerce,https://github.com/nopSolutions/nopCommerce/issues/7212,Import orders. Set the region depending on the country,"nopCommerce version: 4.70 When importing orders, the state code is reading the first matching value from the StateProvince table without regard for what country was specified. See also #7211",source-file
4717,nopCommerce,https://github.com/nopSolutions/nopCommerce/issues/4717,"Empty ""Name"" fileld after adding new record to messages list in SendinBlue plugin",nopCommerce version: 4.30 RC It should be set to some default value instead of empty string.,config-file | source-file
